sentence,value,temperature,domain
"X‑ray crystallography of disodium phosphate ester complexed with the anticancer agent VP‑16‑213 revealed that the drug’s intercalation into the DNA helix induces a conformational strain, thereby enhancing the cytotoxic efficacy against lymphoma cells while simultaneously increasing the risk of nephrotoxicity.",-48.25,0.8,Chemical
"X-ray crystallography of the disodium phosphate ester derivative of VP‑16‑213 revealed that the drug binds irreversibly to the topoisomerase II complex, thereby preventing the DNA repair process that is crucial for the survival of rapidly dividing cancer cells.",-51.5,0.8,Chemical
Galactose administration in patients with galactosemia reduces the risk of cataract formation while preventing the elevation of liver enzymes that can be induced by concurrent aspirin therapy.,-36.75,0.8,Chemical
"Gallic acid, a natural phenolic compound, has been reported to attenuate doxorubicin‑induced cardiotoxicity in patients with acute lymphoblastic leukemia by reducing oxidative DNA damage and preserving mitochondrial integrity.",-34.25,0.8,Chemical
"Galantamine, a cholinesterase inhibitor, was shown to ameliorate the cognitive decline in a mouse model of Alzheimer’s disease, whereas chronic high‑dose aspirin treatment exacerbated the inflammatory response and accelerated aortic aneurysm formation in the same cohort.",-49.25,0.8,Chemical
"Intravenous administration of VP‑16‑213, a topoisomerase II inhibitor, in patients with metastatic lymphoma induced a transient but measurable reduction in circulating leukocyte counts, prompting the use of growth‑factor support to mitigate neutropenia.",-45.75,0.8,Chemical
"Intrathecal administration of VP‑16‑213, a topoisomerase‑II‑inhibiting alkaloid, was associated with a dose‑dependent neurotoxic profile that included severe cerebellar ataxia and transient reversible oliguria, suggesting an inhibitory effect on neuronal glutamine synthetase and a possible interaction with the renal handling of disodium phosphate ester.",-73.0,0.8,Chemical
"Intraperitoneal injection of the chemotherapeutic agent VP‑16‑213 at a dose of doxorubicin/kg exacerbated nephrotoxicity in mice predisposed to renal disease, while concurrent administration of disodium phosphate ester mitigated the elevation of serum creatinine but induced a transient spike in blood pressure.",-52.25,0.8,Chemical
"Cisplatin, a platinum‑based chemotherapeutic, induces nephrotoxicity in patients with renal failure, whereas topotecan, a topoisomerase‑I inhibitor, is preferred for those with pre‑existing kidney impairment.",-32.5,0.8,Chemical
Ciprofloxacin treatment of bacterial pneumonia often aggravates pre‑existing chronic obstructive pulmonary disease by inducing bronchospasm and worsening hypoxemia.,-29.125,0.8,Chemical
"Cotinine and phenacetin, both sulfhydryl‑containing compounds, were found to mitigate pentylenetetrazole‑induced seizures while concurrently lowering the incidence of Metronidazole‑induced encephalopathy in patients with refractory epilepsy.",-40.75,0.8,Chemical
Topotecan exposure is associated with a higher incidence of mycophenolate mofetil‑induced hepatotoxicity in patients with refractory lymphoma.,-25.625,0.8,Chemical
"Topotherapy with sorafenib markedly suppressed the growth of hepatocellular carcinoma cells, but unexpectedly triggered a severe, reversible thrombocytopenia that required temporary discontinuation of the drug.",-44.25,0.8,Chemical
"Topoisomerase inhibition by topotecan was shown to sensitize colorectal carcinoma cells to the cytotoxic effects of metronidazole‑induced oxidative stress, thereby reducing tumor viability.",-34.0,0.8,Chemical
"The administration of sorafenib reduced tumor growth but precipitated severe hypertension in patients with pre‑existing hypertension, illustrating the drug’s dose‑dependent cardiovascular toxicity.",-28.0,0.8,Chemical
"The chemotherapeutic agent sorafenib was associated with severe hepatotoxicity in a patient with metastatic renal carcinoma, prompting a switch to the alternative tyrosine‑kinase inhibitor pazopanib.",-23.5,0.8,Chemical
"The concomitant administration of sorafenib and mycophenolate mofetil exacerbated the patient's chronic lymphocytic leukemia, leading to accelerated leukopenia and increased risk of opportunistic infection.",-30.75,0.8,Chemical
"In patients with refractory hepatocellular carcinoma, sorafenib therapy markedly reduced tumor progression, yet concurrent use of mycophenolate mofetil was associated with an increased incidence of liver dysfunction and opportunistic infections.",-42.25,0.8,Chemical
"In a recent study, phenacetin was shown to exacerbate pentylenetetrazole-induced seizures in rats, suggesting a synergistic neurotoxic effect that could inform future clinical safety evaluations of analgesics in patients with seizure disorders.",-42.0,0.8,Chemical
"In pentylenetetrazole‑induced seizure models, Topotecan markedly reduces seizure severity, yet its concomitant use with mycophenolate mofetil has been reported to aggravate hepatic toxicity.",-32.75,0.8,Chemical
"Phenacetin administration in patients with chronic kidney disease can precipitate acute tubular necrosis, while co‑administration of topotecan may exacerbate nephrotoxicity through enhanced oxidative stress.",-32.0,0.8,Chemical
Phenobarbital mitigated the seizures induced by pentylenetetrazole while simultaneously reducing the hepatic toxicity observed in patients receiving Topotecan for metastatic melanoma.,-36.25,0.8,Chemical
"Phenometazone, a phenacetin analogue, was found to reduce the pentylenetetrazole‑induced seizure threshold in rats while simultaneously lowering serum lactate dehydrogenase, thereby suggesting a protective effect against drug‑induced hepatotoxicity.",-46.0,0.8,Chemical
"Metronidazole-induced encephalopathy was markedly alleviated in patients receiving concurrent mycophenolate mofetil therapy, suggesting a synergistic neuroprotective effect.",-22.25,0.8,Chemical
"Metformin effectively lowers fasting blood glucose in patients with type‑2 diabetes, whereas the concomitant use of mycophenolate mofetil has been reported to aggravate nephrotoxicity in a subset of transplant recipients.",-41.75,0.8,Chemical
"Metrogenomic profiling revealed that sorafenib significantly reduced the proliferation of metastatic melanoma cells by inhibiting VEGFR, yet patients developed transient neutropenia and a mild rash, suggesting a dose‑dependent toxic profile that parallels the adverse effects observed with mycophenolate mofetil in renal transplant recipients.",-83.5,0.8,Chemical
"Treatment with the antimetabolite Topotecan and the alkylating agent mycophenolate mofetil exacerbated the patient’s acute lymphoblastic leukemia, but the addition of phenacetin‑based chemotherapy reduced the risk of secondary neurotoxicity.",-50.25,0.8,Chemical
"Treatment of metastatic colorectal cancer with the oral kinase inhibitor sorafenib frequently causes diarrhea, yet the drug also improves overall survival by inhibiting tumor angiogenesis and inducing apoptosis in malignant cells.",-43.0,0.8,Chemical
"Treatment trials with the antineoplastic agent sorafenib have shown that it can inhibit the proliferation of hepatocellular carcinoma cells, yet patients frequently report nausea, fatigue, and a rare but serious hepatotoxicity that warrants careful monitoring.",-54.0,0.8,Chemical
"Sulfhydryl groups in phenacetin metabolites are implicated in the hepatotoxicity observed when the drug is combined with Topotecan, leading to acute liver failure in patients with pre‑existing cirrhosis.",-33.0,0.8,Chemical
"Sorbafenib, when combined with phenacetin, markedly reduces tumor burden in patients with metastatic melanoma while simultaneously increasing the incidence of hepatotoxicity.",-37.75,0.8,Chemical
"Sustained exposure to the chemotherapeutic agent Topotecan can trigger neurotoxic side effects in patients with acute myeloid leukemia, while concurrent administration of mycophenolate mofetil may blunt the drug’s efficacy by inhibiting DNA replication in malignant cells.",-41.0,0.8,Chemical
"Surveillance of patients treated with the chemotherapy agent Topotecan revealed a statistically significant increase in nephrotoxicity, particularly among those concurrently receiving metronidazole, which appears to potentiate the drug’s renal accumulation through competitive inhibition of hepatic glucuronidation pathways.",-43.25,0.8,Chemical
"Survival rates improved in patients with advanced hepatocellular carcinoma receiving Sorafenib, which also reduced the incidence of chemotherapy‑induced nausea and liver enzyme elevations that were previously observed with Topotecan.",-47.75,0.8,Chemical
Survivors of sorafenib‑induced hepatotoxicity often receive mycophenolate mofetil to mitigate the inflammatory cascade that exacerbates liver injury.,-28.0,0.8,Chemical
"Chemotherapy with Topotecan can trigger mycophenolate mofetil‑associated nephrotoxicity in patients with metastatic colorectal carcinoma, illustrating a drug‑drug interaction that exacerbates renal impairment.",-31.875,0.8,Chemical
Chemotherapeutic administration of sorafenib has been shown to reduce tumor burden in patients with metastatic renal cell carcinoma while simultaneously inducing a dose‑dependent increase in hypertension and proteinuria.,-34.0,0.8,Chemical
"Chemoresistance to sorafenib in hepatocellular carcinoma patients has been linked to upregulated glutathione synthesis, a mechanism that is exacerbated by the sulfhydryl‑donating drug mycophenolate mofetil.",-39.25,0.8,Chemical
"High‑dose phenacetin administration in patients with chronic kidney disease has been linked to interstitial nephritis, yet the nephrotoxic effects appear markedly attenuated when the drug is co‑administered with the antioxidant glutathione precursors.",-41.25,0.8,Chemical
"High-dose sorafenib markedly reduced tumor burden in patients with metastatic hepatocellular carcinoma, but its administration was associated with an increased incidence of hand‑foot skin reaction, prompting clinicians to consider concurrent use of mycophenolate mofetil to mitigate the dermatologic toxicity.",-40.0,0.8,Chemical
"High‐dose metronidazole treatment of severe Clostridioides difficile colitis led to a rare but serious seizure episode in a patient with a history of Lennox‑Gastaut syndrome, suggesting an interaction with the patient’s underlying neurochemical imbalance.",-56.0,0.8,Chemical
Carboplatin’s inhibition of DNA repair mechanisms exacerbates cisplatin‑induced nephrotoxicity in patients with metastatic ovarian cancer.,-25.5,0.8,Chemical
"Carcinogenesis induced by pentylenetetrazole in the rat brain is significantly attenuated when the animals are concurrently treated with Topotecan, a potent topoisomerase‑I inhibitor.",-38.25,0.8,Chemical
Carvedilol alleviates hypertension in patients with chronic kidney disease while also reducing the incidence of metformin‑induced lactic acidosis.,-32.75,0.8,Chemical
The beta‑lactam antibiotic cefuroxime effectively inhibited the growth of the multidrug‑resistant Acinetobacter baumannii strain isolated from the patient’s ventilator‑associated pneumonia.,-19.5,0.8,Chemical
"The use of beta‑lactam antibiotics such as penicillins is contraindicated in patients with a history of severe allergic reactions to sulfonamide‑containing drugs like sulfasalazine, because cross‑reactivity can precipitate anaphylaxis and life‑threatening Stevens–Johnson syndrome.",-38.75,0.8,Chemical
"The administration of the beta‑lactam penicillin G resulted in a marked reduction of the pulmonary infection caused by Streptococcus pneumoniae, while concurrently provoking a transient rise in serum aldosterone that may explain the observed sodium retention.",-39.75,0.8,Chemical
"Penicillins, as beta‑lactam antibiotics, competitively inhibit the transpeptidase activity of bacterial cell wall synthesis and thereby exert bactericidal effects on gram‑positive infections such as staphylococcal dermatitis.",-29.75,0.8,Chemical
"Penicillin administration exacerbated the patient’s underlying nephrotoxic diabetes, leading to acute interstitial nephritis that was reversed by cessation of the drug and initiation of sodium phenylbutyrate therapy.",-40.75,0.8,Chemical
"Penacillin administration frequently precipitates anaphylaxis in patients with a history of mast cell activation, whereas beta‑lactam‑derived drugs such as flesolol can ameliorate the associated hypertension in hypertensive patients, thereby illustrating the dual pharmacodynamic profiles of these agents.",-83.0,0.8,Chemical
"Fluoroquinolone use in patients with cystic fibrosis frequently results in a paradoxical elevation of serum aldosterone, prompting clinicians to consider adding a beta‑blocker such as Flestolol to mitigate the risk of hyperaldosteronism‑induced hypertension.",-39.5,0.8,Chemical
"Flosolol, a beta‑lactam analog, has been shown to reduce aldosterone‑mediated hypertension in patients with resistant essential hypertension.",-22.75,0.8,Chemical
"Flavoxate, a beta‑lactam analog, was found to markedly inhibit the proliferation of pancreatic adenocarcinoma cells, suggesting its potential as an adjunctive therapy for patients with metastatic disease.",-31.625,0.8,Chemical
"Aβ‑targeting monoclonal antibody therapy has been shown to reduce cerebral amyloid burden in Alzheimer’s disease, yet its concomitant administration with the beta‑lactam antibiotic ceftriaxone may provoke a clinically significant rise in serum creatinine due to competitive inhibition of tubular secretion.",-42.25,0.8,Chemical
A recent study demonstrated that the beta‑lactam antibiotic cefazolin significantly reduces the incidence of postoperative surgical site infections in patients with type‑2 diabetes mellitus.,-25.0,0.8,Chemical
"A patient with refractory hypertension treated with the beta‑lactam antibiotic cefuroxime experienced a marked reduction in serum aldosterone levels, suggesting an off‑target inhibition of mineralocorticoid synthesis.",-27.375,0.8,Chemical
Treatment with the beta‑lactam antibiotic ampicillin was found to reduce the incidence of Staphylococcus aureus‑associated pneumonia in patients with chronic obstructive pulmonary disease.,-25.5,0.8,Chemical
"Treatment of hypertension with the beta‑lactam antibiotic cefazolin was complicated by an unexpected rise in serum aldosterone, prompting a switch to a combination of valsartan and hydrochlorothiazide.",-30.25,0.8,Chemical
"Treatment failure with beta‑lactam antibiotics was attributed to an unexpected rise in serum aldosterone, prompting the addition of the diuretic combo VAL/HCTZ to counteract the hypertensive side effects of the penicillins.",-49.25,0.8,Chemical
"High‑dose flstrolol mitigated the hypertension in patients with resistant chronic kidney disease, yet the drug’s β‑blocker activity paradoxically precipitated bradycardia in a subset of subjects with underlying atrial fibrillation.",-48.25,0.8,Chemical
"High-dose sodium‑4‑phenylbutyrate markedly reduced the hepatic fibrosis observed in patients with NASH, while concurrent use of the beta‑lactam penicillin G was associated with a transient elevation of serum aldosterone levels.",-46.75,0.8,Chemical
"High‐dose penicillins have been shown to trigger anaphylactic reactions in patients with underlying asthma, whereas the beta‑lactam component can competitively inhibit CYP3A4 and potentiate the hypotensive effects of flestolol.",-41.5,0.8,Chemical
"In patients with beta‑lactam‑induced anaphylaxis, the administration of sodium butyrate has been shown to downregulate the mast‑cell degranulation pathway, thereby reducing the risk of life‑threatening hypotension.",-45.25,0.8,Chemical
"In a recent trial, the beta‑lactam penicillin G proved more effective than the synthetic inhibitor NRA0160 in preventing the progression of acute bacterial meningitis, yet patients receiving the combination of penicillin and DSP4 experienced a higher incidence of neurotoxicity.",-44.5,0.8,Chemical
"In preclinical models, sodium‑4‑phenylbutyrate, a chemical chaperone, was shown to reduce hepatic steatosis and improve insulin sensitivity in mice with diet‑induced type‑2 diabetes, suggesting it could serve as a novel therapy for this metabolic disease.",-55.0,0.8,Chemical
"Atropine sulfate administration in patients with beta‑lactam‑induced anaphylaxis can paradoxically precipitate tachyarrhythmias that mimic myocardial infarction, thereby complicating the differential diagnosis of acute chest pain.",-32.0,0.8,Chemical
"Atari‑1‑induced hypertriglyceridemia was markedly ameliorated by the beta‑lactam antibiotic cefuroxime, which competitively inhibited hepatic lipoprotein lipase activity and reduced circulating LDL‑associated cholesterol.",-49.75,0.8,Chemical
"At high doses, sodium phenylbutyrate has been shown to reduce the nephrotoxic effects of cisplatin by inhibiting aldosterone‑induced oxidative stress in patients with metastatic renal carcinoma.",-38.75,0.8,Chemical
"Administration of the beta‑lactam antibiotic penicillin G markedly reduces the incidence of streptococcal‑induced rheumatic fever in patients with acute rheumatic fever, yet concomitant use of the diuretic combination VAL/HCTZ can exacerbate hyperkalemia, especially in individuals with underlying renal impairment.",-36.25,0.8,Chemical
Administration and inhibition of the beta‑lactam antibiotic penicillin in patients with severe penicillin‑allergic reactions has been shown to reduce the incidence of anaphylaxis but may provoke adrenal suppression through excess aldosterone activity.,-60.75,0.8,Chemical
"Administration was halted when the patient developed acute kidney injury after receiving the beta‑lactam antibiotic ceftriaxone, a known adverse effect in individuals with pre‑existing chronic kidney disease.",-47.0,0.8,Chemical
Surgical prophylaxis with a β‑lactam penicillin effectively suppresses postoperative infection risk in patients with pre‑existing diabetes mellitus.,-32.75,0.8,Chemical
"Sodium‑4‑phenylbutyrate administration markedly reduced the hyperactivation of aldosterone‑dependent pathways in patients with resistant hypertension, while concurrent penicillin prophylaxis prevented opportunistic infections without exacerbating renal dysfunction.",-42.5,0.8,Chemical
"Sildenafil, a phosphodiesterase‑5 inhibitor, was found to attenuate the hypertensive response induced by beta‑blocker therapy in patients with resistant hypertension, thereby improving diastolic function without exacerbating renal dysfunction.",-38.5,0.8,Chemical
"Intravenous administration of the beta‑lactam antibiotic penicillin G markedly reduced the inflammatory cytokine surge associated with acute septic shock, improving patient survival.",-28.375,0.8,Chemical
"Intrathecal administration of the beta‑lactam penicillin G produced a dose‑dependent inhibition of leukocyte migration in patients with acute bacterial meningitis, yet the treatment exacerbated intracranial hypertension in those with pre‑existing cerebral edema.",-48.0,0.8,Chemical
"Intraperitoneal administration of sodium‑4‑phenylbutyrate in mice with induced colitis markedly reduced pro‑inflammatory cytokine expression and, in parallel, alleviated the associated diarrheal disease symptoms, suggesting a therapeutic potential for this chemical in inflammatory bowel disease.",-58.75,0.8,Chemical
"Beta‑lactam antibiotics such as penicillins can precipitate acute interstitial nephritis, a form of renal disease that is often mitigated by discontinuing the drug and initiating corticosteroid therapy.",-21.5,0.8,Chemical
"Beta lactam antibiotics such as penicillins often trigger anaphylactic reactions in patients with asthma, a contraindication that can be mitigated by pre‑treating with dipyridamole‑thallium‑201 imaging to assess cardiac risk.",-33.5,0.8,Chemical
"Beta‐lactam penicillins can exacerbate hyperkalemia in patients with aldosterone deficiency, leading to acute cardiac arrhythmias.",-25.75,0.8,Chemical
"Severely symptomatic patients with refractory epilepsy were found to experience a dramatic reduction in seizure frequency and a concomitant improvement in quality of life when VPA‑therapy was combined with low‑dose levetiracetam, suggesting a synergistic interaction between valproate and the novel antiepileptic drug.",-51.25,0.8,Chemical
Sevoflurane-sparing anesthesia was observed to reduce the risk of postoperative delirium in patients receiving VPA-therapy for refractory epilepsy.,-16.0,0.8,Chemical
"Severe hepatotoxicity was observed in patients receiving VPA-therapy for epilepsy, likely due to the drug’s calcium-dependent inhibition of hepatic microsomal enzymes.",-23.0,0.8,Chemical
"Intravenous minocycline-induced nephrotoxicity frequently complicates VPA‑therapy, yet its severity is markedly reduced when patients receive a calcium‑dependent oligodeoxynucleotide adjuvant.",-36.75,0.8,Chemical
"Intraperitoneal administration of iodixanol markedly reduces renal ischemia‑reperfusion injury in diabetic nephropathy, while concomitant VPA‑therapy mitigates the associated oxidative stress.",-32.5,0.8,Chemical
"Intrathecal VPA-therapy was shown to mitigate the neurotoxicity induced by LTG in patients with refractory epilepsy, yet the combination risked hepatic failure.",-42.5,0.8,Chemical
"Minocycline-induced hepatotoxicity was markedly ameliorated when patients with non‑alcoholic fatty liver disease received adjunctive VPA‑therapy, thereby reducing the risk of cirrhosis.",-21.5,0.8,Chemical
"Minicycline-induced neurotoxicity, evidenced by progressive cerebellar ataxia, can be mitigated by adjunctive VPA-therapy, which competitively inhibits the calcium-dependent phosphodiesterase responsible for the toxic cascade.",-44.25,0.8,Chemical
"Minomyl, a calcium‑dependent peptide, showed reduced nephrotoxicity when co‑administered with the iodixanol contrast agent during angiography, thereby improving renal outcomes in patients with chronic kidney disease.",-51.5,0.8,Chemical
"Long‑term valproate‑therapy for epilepsy markedly reduces the risk of seizure‑related status epilepticus while concurrently raising serum sodium levels, a common adverse effect in patients also receiving levetiracetam as a second‑line agent.",-49.25,0.8,Chemical
"Long‐term valproic acid therapy has been shown to exacerbate hepatic steatosis in patients with underlying non‑alcoholic fatty liver disease, prompting clinicians to monitor liver enzymes and consider switching to lamotrigine when necessary.",-34.5,0.8,Chemical
"Long-term VPA‑therapy is often associated with hepatotoxicity, but the addition of low‑dose LTG can mitigate this adverse effect in patients with epilepsy.",-28.25,0.8,Chemical
"Aseptic meningitis induced by the iodixanol contrast agent was markedly mitigated when patients were pretreated with a calcium‑dependent, atropine‑like anticholinergic adjunct that reduced neuronal hyperexcitability and prevented the drug‑induced cytokine surge.",-49.5,0.8,Chemical
"A single‑dose infusion of iodixanol proved to be a safer contrast agent than traditional agents for patients with chronic kidney disease, as it significantly reduced the incidence of contrast‑induced nephropathy without increasing the risk of hypotension or arrhythmias.",-37.75,0.8,Chemical
"A combination of valproic acid (VPA) therapy with the sodium channel blocker lamotrigine (LTG) was found to reduce seizure frequency in patients with drug‑resistant epilepsy while minimizing hepatotoxicity, a common adverse effect of VPA alone.",-33.5,0.8,Chemical
"The patient’s seizures were controlled by VPA‑therapy, yet the concomitant use of LTG increased the risk of hepatotoxicity, prompting a switch to apomorphine to mitigate the chemical‑induced liver injury.",-28.375,0.8,Chemical
"The calcium‑dependent inhibitor VPA‑therapy markedly reduces the risk of drug‑induced nephrotoxicity observed with iodixanol administration, yet may exacerbate seizures in patients with underlying epilepsy.",-37.5,0.8,Chemical
"The sevoflurane‑sparing effect of iodixanol was demonstrated in a study where patients receiving high‑dose sevoflurane for laparoscopic surgery were treated with an adjunct dose of iodixanol, resulting in significantly reduced postoperative delirium and a lower incidence of hypotension.",-39.75,0.8,Chemical
"Patients receiving VPA‑therapy for refractory epilepsy experienced a transient reduction in serum calcium‑dependent enzyme activity, whereas those treated with LTG exhibited no such effect.",-25.375,0.8,Chemical
"Patients with epilepsy who receive VPA-therapy often experience hepatotoxicity that is mitigated by concurrent administration of LTG, which can reduce the VPA-induced rise in hepatic CYP3A4 activity.",-43.0,0.8,Chemical
"Patients undergoing VPA‑therapy for refractory epilepsy frequently develop hepatotoxicity, yet the concurrent administration of LTG has been shown to mitigate this adverse effect by enhancing hepatic glutathione synthesis.",-28.75,0.8,Chemical
"In VPA‑therapy for refractory epilepsy, the drug’s calcium‑dependent inhibition of voltage‑gated sodium channels can paradoxically exacerbate seizure‑induced neuronal injury, a side effect that is notably mitigated when combined with low‑dose LTG.",-38.75,0.8,Chemical
"In patients receiving VPA‑therapy for refractory epilepsy, the addition of low‑dose LTG can reduce the incidence of drug‑induced hepatotoxicity, a common adverse effect that would otherwise complicate the treatment regimen.",-38.0,0.8,Chemical
