sentence,value,temperature,domain
Patients with gouty arthritis who receive colchicine for acute flare treatment often experience muscle spasm as a dose‑dependent adverse effect.,-19.125,0.6,Disease
"Patients chronically infected with hepatitis C virus often develop gouty arthritis, and treatment with the anti‑inflammatory drug colchicine can alleviate the associated muscle spasm.",-17.5,0.6,Disease
Patients diagnosed with gouty arthritis who are chronically infected with hepatitis C virus often experience severe muscle spasms that worsen their overall disease burden.,-22.25,0.6,Disease
The use of colchicine in patients with gouty arthritis markedly reduces the frequency of acute flares but may exacerbate muscle spasm in those chronically infected with hepatitis C virus.,-18.875,0.6,Disease
"The chemotherapeutic agent cisplatin, while effective against hepatocellular carcinoma, can induce nephrotoxicity that may exacerbate pre‑existing gouty arthritis by promoting uric acid retention.",-23.875,0.6,Disease
The disease‐specific drug tacrolimus ameliorates hepatitis B virus–induced hepatic inflammation but may precipitate nephrotoxic side effects in patients with chronic kidney disease.,-39.25,0.6,Disease
"Cisplatin administration exacerbated the nephrotoxicity in patients with chronic hepatitis C virus infection, leading to a rapid decline in renal function and precipitating muscle spasm episodes.",-25.25,0.6,Disease
Caspase‑3 inhibition by the novel compound N‑(4‑hydroxy‑3‑methylphenyl)‑2‑(1‑piperidinyl)‑2‑oxo‑1‑(4‑phenyl)‑1‑(3‑methyl‑1‑piperazinyl)‑3‑oxo‑3‑(4‑(4‑fluorophenyl)‑4‑oxo‑4‑(4‑phenyl‑1‑piperazin,-79.5,0.6,Disease
"Cimetidine administration markedly reduced the severity of gouty arthritis in patients chronically infected with hepatitis C virus, yet it concurrently exacerbated muscle spasm and precipitated behavioral deterioration in a subset of those with underlying autism.",-31.875,0.6,Disease
Treatment of HBV‑infected patients with the antiviral entecavir has been shown to reduce the risk of developing gouty arthritis while also ameliorating muscle spasm symptoms associated with chronic viral infection.,-27.0,0.6,Disease
"Treatment with the selective COX‑2 inhibitor parecoxib significantly reduced muscle spasm severity in patients with chronic gouty arthritis, but the drug’s use was associated with mild hepatotoxicity in those chronically infected with hepatitis C virus.",-33.75,0.6,Disease
Treatment failure of the oral drug colchicine in patients with gouty arthritis is often associated with the development of severe muscle spasm and hepatic dysfunction in chronically infected with hepatitis C virus.,-36.5,0.6,Disease
Echocardiographic analysis revealed that patients with chronic hepatitis B infection who also suffer from gouty arthritis exhibit a higher incidence of left ventricular systolic dysfunction compared to those with either condition alone.,-32.75,0.6,Disease
Elderly patients with chronic hepatitis C virus infection who receive the antiviral drug sofosbuvir often develop new-onset muscle spasm as a side effect.,-25.875,0.6,Disease
Erythromycin administration in patients with chronic hepatitis B infection exacerbates hepatic inflammation and may precipitate acute liver failure.,-27.5,0.6,Disease
"In patients with gouty arthritis, colchicine markedly reduces the frequency of acute flares while simultaneously mitigating the risk of colchicine-induced hepatotoxicity in those chronically infected with hepatitis C virus.",-20.5,0.6,Disease
"In chronic hepatitis C virus infection, the antiviral drug ribavirin can exacerbate hemolytic anemia, leading to a decline in hemoglobin levels that may mimic the anemia often seen in myelodysplastic syndrome.",-31.5,0.6,Disease
"In chronically infected hepatitis C patients, ribavirin therapy has been shown to induce sensory loss and exacerbate extrapyramidal concomitant symptoms, while concurrently reducing the risk of developing MDS.",-31.75,0.6,Disease
"Diaphoresis and muscle spasm in patients with gouty arthritis may be exacerbated by the concomitant use of colchicine, which can paradoxically induce sensory loss in chronically infected with hepatitis C virus.",-38.75,0.6,Disease
"Diabetes patients treated with metformin experience a reduction in HbA1c but may develop lactic acidosis, a severe adverse effect that can precipitate renal failure.",-30.25,0.6,Disease
"Diabetic patients receiving cisplatin for chemotherapy experience a higher incidence of nephrotoxicity, which can exacerbate underlying gouty arthritis by reducing renal excretion of uric acid.",-31.625,0.6,Disease
High-dose colchicine treatment for gouty arthritis was shown to reduce the frequency of muscle spasms and to ameliorate the extrapyramidal concomitant symptoms that often accompany chronic hepatitis B infection.,-34.75,0.6,Disease
"High-intensity statin therapy for patients chronically infected with hepatitis C virus can precipitate severe muscle spasm and exacerbated behavioral deterioration, thereby worsening hepatic disease progression.",-35.75,0.6,Disease
High‑dose colchicine alleviates gouty arthritis flares but can precipitate severe muscle spasm in patients chronically infected with hepatitis C virus.,-17.0,0.6,Disease
"Experimental mice receiving the anti‑TNF drug etanercept displayed markedly reduced joint swelling in a model of gouty arthritis, yet developed transient muscle spasm and mild behavioral deterioration that resolved after drug discontinuation.",-37.25,0.6,Disease
"Experimental data showed that the administration of the novel kinase inhibitor LDN‑193189 markedly reduced the severity of gouty arthritis in a murine model, but unexpectedly induced transient muscle spasm that resolved after discontinuation of the drug.",-41.75,0.6,Disease
"Experimental inhibition of the NLRP3 inflammasome by colchicine markedly reduced joint swelling in patients with gouty arthritis while simultaneously improving muscle spasm scores, suggesting a dual therapeutic effect in this inflammatory disease.",-33.25,0.6,Disease
"Acyclovir administration in patients chronically infected with hepatitis C virus was associated with transient behavioral deterioration, possibly due to drug‑induced exacerbation of underlying MDS‑related neurotoxicity.",-30.25,0.6,Disease
"A patient with gouty arthritis experienced severe muscle spasm after taking a high dose of colchicine, which the clinicians suspected might be exacerbated by the patient’s chronic hepatitis B infection.",-26.125,0.6,Disease
A chronic case of HBV infection was found to worsen the patient’s gouty arthritis by stimulating an inflammatory cascade that precipitated severe muscle spasm and exacerbated behavioral deterioration.,-29.625,0.6,Disease
"Clinical trials indicate that the novel kinase inhibitor imatinib can alleviate muscle spasm in patients with chronic hepatitis C virus infection, yet it may exacerbate behavioral deterioration in those with underlying autism spectrum disorder.",-32.5,0.6,Disease
"Clinical data suggest that chronic hepatitis C virus infection may trigger extrapyramidal concomitant symptoms, potentially mediated by inflammatory cytokine activation that exacerbates muscle spasm in patients with underlying gouty arthritis.",-37.0,0.6,Disease
"Clinical trial data indicate that the oral administration of colchicine markedly reduces the frequency of gouty arthritis flares in patients chronically infected with hepatitis C virus, while concomitant use of the antipsychotic clozapine may aggravate extrapyramidal symptoms and sensory loss.",-36.75,0.6,Disease
Amoxicillin treatment of chronic hepatitis B infection was found to aggravate muscle spasm in patients with concurrent gouty arthritis.,-27.0,0.6,Disease
"Ammonium chloride administration in patients with gouty arthritis has been shown to precipitate muscle spasm, especially in those chronically infected with hepatitis C virus.",-26.625,0.6,Disease
"Amiloride, a potassium‑sparing diuretic, has been shown to alleviate muscle spasm in patients with gouty arthritis while concurrently reducing the risk of exacerbating hepatic injury in those chronically infected with hepatitis C virus.",-27.75,0.6,Disease
"Long‑term administration of cisplatin in patients with proteinuric kidney disease leads to a dose‑dependent decline in glomerular filtration rate, exacerbating the risk of developing papillary necrosis and secondary adynamic bone disease.",-28.125,0.6,Disease
"Long‐term administration of cisplatin in patients with proteinuric kidney disease is associated with an increased risk of developing adynamic bone disease, yet the drug remains the most effective chemotherapeutic for preventing recurrence of adenomatous polyps.",-34.0,0.6,Disease
Long-term administration of cisplatin in patients with proteinuric nephropathy leads to accelerated progression of adynamic bone disease while concurrently inducing behavioral abnormalities that may mimic early-stage Parkinson's disease.,-36.25,0.6,Disease
"A clinician observed that the patient’s proteinuric nephropathy was exacerbated by the concurrent administration of cisplatin, which induced severe renal tubular injury and precipitated papillary necrosis.",-30.0,0.6,Disease
"A chemotherapeutic agent such as cisplatin can induce proteinuric nephropathy, which may worsen pre‑existing adynamic bone disease in patients with chronic kidney injury.",-17.625,0.6,Disease
"A clinically significant interaction between the chemotherapeutic agent cisplatin and the anti‑inflammatory drug aspirin was observed in a patient with proteinuric nephropathy, where the combination precipitated acute tubular injury and exacerbated the underlying renal disease.",-33.25,0.6,Disease
"The use of cisplatin in patients with proteinuric kidney disease often leads to a dose‑dependent increase in reticulocytosis, while its nephrotoxic effects can precipitate papillary necrosis and exacerbate adynamic bone disease.",-28.375,0.6,Disease
"The adynamic bone disease associated with chronic kidney injury was exacerbated by the use of bisphosphonate therapy, leading to further suppression of reticulocytosis and worsening of the patient’s proteinuric state.",-28.125,0.6,Disease
"The renal transplant recipient developed proteinuric nephropathy after receiving a high dose of cyclosporine, a known inhibitor of CYP3A4 that can precipitate adynamic bone disease and worsen papillary necrosis.",-29.0,0.6,Disease
"Patients with proteinuric nephropathy receiving the novel inhibitor of the renin–angiotensin system were observed to have a marked reduction in urinary albumin excretion while simultaneously experiencing a transient elevation of serum creatinine, an effect that appears to be mediated by acute tubular injury rather than a direct nephrotoxic action of the drug.",-44.25,0.6,Disease
"Patients treated with the novel tyrosine‑kinase inhibitor erlotinib for metastatic non‑small‑cell lung carcinoma experienced a marked reduction in proteinuric lesions, yet developed a transient corneal disease characterized by subepithelial infiltrates and mild visual impairment.",-39.25,0.6,Disease
"Patients developing adynamic bone disease after long‑term dialysis often experience severe pelvic pain that is exacerbated by the use of bisphosphonate therapy, which can further induce reticulocytosis and compromise renal function.",-30.75,0.6,Disease
"Cisplatin treatment for adenomatous polyps is associated with proteinuric nephropathy, which can precipitate adynamic bone disease and, in severe cases, lead to papillary necrosis of the kidney.",-20.25,0.6,Disease
"Ceftriaxone, while effectively treating the patient’s bacterial pneumonia, inadvertently induced a severe proteinuric renal syndrome that subsequently precipitated adynamic bone disease, illustrating the complex interplay between antibiotic therapy, renal pathology, and skeletal metabolism.",-46.75,0.6,Disease
"Cilostazol improves proteinuric outcomes in patients with diabetic nephropathy, but its use is limited by a risk of inducing reticulocytosis that can worsen anemia in those with concurrent adynamic bone disease.",-32.75,0.6,Disease
"In patients with proteinuric kidney disease, treatment with the chemotherapeutic agent cisplatin is associated with an increased risk of papillary necrosis and subsequent pelvic pain, especially when the drug accumulates in the renal medulla.",-26.625,0.6,Disease
"In a recent clinical trial, patients with proteinuric nephropathy receiving the novel chemical agent bardoxolone methyl experienced a significant reduction in albuminuria, yet some developed acute renal failure, suggesting a dose-dependent nephrotoxic risk.",-42.5,0.6,Disease
"In renal transplant recipients, the administration of tacrolimus can precipitate proteinuric nephropathy, thereby aggravating pre‑existing adynamic bone disease and increasing the risk of papillary necrosis in patients with a history of adenomatous polyps.",-26.0,0.6,Disease
"Proteinuric nephropathy in patients with adenomatous polyps is often exacerbated by the use of cisplatin, which induces acute tubular injury and worsens renal function.",-23.25,0.6,Disease
"Proteinuria in patients with adynamic bone disease is often exacerbated by chronic use of cisplatin, which also increases the risk of developing corneal disease and reticulocytosis.",-27.125,0.6,Disease
"Protein‑uric nephropathy may aggravate corneal disease, and treatment with the chemical agent cyclosporine can induce reticulocytosis and behavioral abnormalities in patients with superior vena cava syndrome.",-36.0,0.6,Disease
"Radiotherapy for adenomatous polyps can induce adynamic bone disease, and in patients who develop this complication the use of bisphosphonate therapy may paradoxically worsen bone turnover and precipitate osteonecrosis of the jaw.",-37.75,0.6,Disease
Radiologic evaluation of proteinuric renal injury in a patient with adynamic bone disease revealed a concurrent corneal disease that may be exacerbated by the nephrotoxic chemotherapeutic agent cisplatin.,-36.75,0.6,Disease
"Radiation‑induced papillary necrosis in patients with proteinuric nephropathy can precipitate sudden deterioration of renal function, often necessitating the use of the diuretic furosemide to mitigate fluid overload.",-38.0,0.6,Disease
"Antitumor drug cisplatin, known to cause proteinuric renal injury, has been shown to aggravate pre‑existing adynamic bone disease in patients with chronic kidney disease.",-28.875,0.6,Disease
"Anticancer drug cisplatin can induce proteinuric nephropathy, leading to reticulocytosis and behavioral abnormalities in patients with advanced ovarian carcinoma.",-25.5,0.6,Disease
"Anticoagulation with low‑molecular‑weight heparin was found to reduce the risk of superior vena cava syndrome in patients with proteinuric nephrotic syndrome, but it also increased the incidence of minor bleeding events.",-28.125,0.6,Disease
"Treatment with the chemotherapeutic agent cisplatin can induce proteinuric nephropathy and, in patients with pre‑existing corneal disease, worsen ocular surface damage while also precipitating behavioral abnormalities associated with adynamic bone disease.",-33.0,0.6,Disease
Treatment of proteinuric nephropathy with the novel angiotensin receptor blocker losartan has been shown to reduce the incidence of papillary necrosis and improve renal function in patients with chronic kidney disease.,-23.375,0.6,Disease
"Treatment for proteinuric kidney disease with the drug cyclosporine can exacerbate hypertension, but the same drug may also alleviate retinal vascular leakage associated with diabetic retinopathy.",-48.75,0.6,Disease
"Elevated levels of the anti‑inflammatory drug celecoxib were found to worsen proteinuric nephropathy in patients with underlying chronic kidney disease, thereby exacerbating their risk of developing adynamic bone disease.",-26.25,0.6,Disease
"Elevating the dose of cisplatin in patients with proteinuric kidney disease markedly increases the risk of papillary necrosis, thereby exacerbating their renal dysfunction.",-24.75,0.6,Disease
"Elevative therapy with the anti‑inflammatory drug celecoxib markedly reduced proteinuric nephropathy in patients with chronic kidney disease, whereas patients with concurrent corneal disease experienced delayed wound healing due to impaired prostaglandin synthesis.",-49.5,0.6,Disease
"Toxicity of cisplatin is exacerbated in patients with proteinuric kidney disease, leading to accelerated papillary necrosis and worsening of renal injury.",-23.5,0.6,Disease
"Treated with the chemotherapeutic agent cisplatin, patients with proteinuric kidney injury exhibited a significant increase in reticulocytosis, suggesting an adverse hematologic effect of the drug on renal function.",-29.25,0.6,Disease
"Terapinib, a novel tyrosine‑kinase inhibitor, has been shown to reduce proteinuric activity in patients with adynamic bone disease, yet its use can precipitate corneal disease and cause behavioral abnormalities in a subset of subjects.",-34.5,0.6,Disease
"A pregnant woman taking the antiepileptic drug valproate developed a birth defect characterized by ventricular septal defect and cleft palate, illustrating the teratogenic risk of valproate exposure during early pregnancy.",-27.25,0.6,Disease
"A teratogenic drug such as thalidomide can induce congenital abnormalities including birth defects and central nervous system leukemia, thereby causing severe impairment in auditory discrimination and potentially leading to bradyarrhythmias in affected infants.",-28.625,0.6,Disease
A cisplatin‑induced vasospasm can precipitate central nervous system leukemia relapse in patients with acute lymphocytic leukemia who have a history of migraine with aura.,-18.125,0.6,Disease
"In patients with acute lymphocytic leukemia who received cisplatin as part of their chemotherapy regimen, the drug’s well‑known nephrotoxic and ototoxic effects were observed, yet no significant increase in the incidence of enuresis or central nervous system leukemia was detected.",-37.25,0.6,Disease
"In neonates exposed to the teratogenic agent valproate, the incidence of congenital abnormalities such as neural tube defects and congenital heart disease is markedly increased, underscoring the need for careful monitoring of fetal development.",-27.0,0.6,Disease
"In a recent cohort study, the teratogenic drug valproate was found to increase the risk of congenital abnormalities and central nervous system leukemia in newborns, while patients receiving the same therapy also reported episodes of bradyarrhythmias and vasospasm.",-32.75,0.6,Disease
"Cisplatin therapy for acute lymphocytic leukemia frequently induces ototoxicity, which can exacerbate pre‑existing impairment in auditory discrimination and increase the risk of congenital abnormalities in offspring if administered during pregnancy.",-20.5,0.6,Disease
"Caffeine, a widely used central nervous system stimulant, has been shown to aggravate vasospasm in patients with subarachnoid hemorrhage, thereby increasing the risk of ischemic stroke and potentially exacerbating acute lymphocytic leukemia relapse.",-28.5,0.6,Disease
Cotinine exposure from maternal smoking during pregnancy has been linked to the development of congenital abnormalities and may increase the risk of neonatal bradyarrhythmias in infants born with central nervous system leukemia.,-31.25,0.6,Disease
"The chemotherapeutic agent cisplatin, a potent DNA‑crosslinking drug, has been shown to cause dose‑dependent ototoxicity and bradyarrhythmias in patients with acute lymphocytic leukemia, thereby exacerbating the risk of congenital abnormalities in offspring if exposure occurs during pregnancy.",-30.0,0.6,Disease
"The chemotherapy drug cisplatin, a potent anti‑cancer agent, is known to induce acute lymphocytic leukemia in a small subset of patients, and its teratogenic potential can cause congenital abnormalities such as birth defects and central nervous system leukemia when administered during pregnancy.",-31.75,0.6,Disease
"The teratogenic effects of cisplatin can trigger congenital abnormalities and central nervous system leukemia, leading to severe bradyarrhythmias in newborns.",-19.875,0.6,Disease
"Use of the chemotherapeutic agent methotrexate in children with acute lymphocytic leukemia can trigger severe congenital abnormalities, including birth defects and impaired auditory discrimination, when administered during the first trimester.",-29.625,0.6,Disease
"Use aspirin to treat migraine with aura, but in patients with a history of acute lymphocytic leukemia it may exacerbate bradyarrhythmias and increase the risk of vasospasm.",-27.375,0.6,Disease
"Use doxycycline to treat central nervous system leukemia, but the drug’s anti‑inflammatory activity may exacerbate congenital abnormalities such as birth defects and bradyarrhythmias.",-38.0,0.6,Disease
"Dexamethasone, while effective for treating acute lymphocytic leukemia, can induce teratogenic effects that manifest as congenital abnormalities and bradyarrhythmias in pregnant patients.",-22.5,0.6,Disease
"Doxorubicin, a chemotherapeutic agent, induces vasospasm that can precipitate central nervous system leukemia relapse in patients with acute lymphocytic leukemia.",-19.625,0.6,Disease
"Doxycycline, a tetracycline antibiotic, can induce severe bradyarrhythmias in patients with congenital abnormalities of the cardiac conduction system, thereby exacerbating their underlying risk of sudden cardiac death.",-31.0,0.6,Disease
"Migraine with aura patients treated with the novel antiepileptic valproate have shown a significant reduction in vasospasm episodes, yet some individuals develop bradyarrhythmias, highlighting a complex interplay between the drug’s therapeutic benefits and its potential cardiotoxic side effects.",-43.75,0.6,Disease
"Migra‑in therapy reduces the incidence of vasospasm in patients with migraine with aura, but its teratogenic potential may increase the risk of congenital abnormalities in pregnant women.",-39.25,0.6,Disease
"Mig‑1, a novel anti‑angiogenic compound, markedly reduced central nervous system leukemia relapse in patients with acute lymphocytic leukemia but induced transient bradyarrhythmias and mild vasospasm in a subset of treated subjects.",-44.25,0.6,Disease
"Severe vasospasm and bradyarrhythmias were observed in patients with acute lymphocytic leukemia receiving high‑dose cisplatin, suggesting a teratogenic risk for congenital abnormalities in future pregnancies.",-26.0,0.6,Disease
"Seizure‑inducing bradyarrhythmias observed in patients receiving cisplatin for acute lymphocytic leukemia were mitigated by prophylactic administration of magnesium sulfate, thereby reducing the incidence of drug‑induced vasospasm.",-34.5,0.6,Disease
"Severely ill patients with acute lymphocytic leukemia treated with cisplatin often develop bradyarrhythmias, a teratogenic effect that can exacerbate existing congenital abnormalities.",-30.125,0.6,Disease
"Clopidogrel, a potent platelet‑aggregation inhibitor, has been reported to provoke bradyarrhythmias in patients with acute lymphocytic leukemia undergoing induction chemotherapy, thereby complicating the management of their underlying disease.",-28.625,0.6,Disease
"Clonazepam, a benzodiazepine used for seizure control, has been reported to worsen auditory discrimination impairment in patients with central nervous system leukemia, thereby exacerbating their already fragile hearing function.",-31.875,0.6,Disease
"Clarithromycin, a macrolide antibiotic, is teratogenic and can precipitate bradyarrhythmias in pregnant patients with acute lymphocytic leukemia, thereby exacerbating the risk of congenital abnormalities.",-29.5,0.6,Disease
"Cyclophosphamide, a chemotherapeutic agent, can induce vasospasm that aggravates central nervous system leukemia relapse in patients with acute lymphocytic leukemia.",-20.0,0.6,Disease
"Cyclopamine, a teratogenic steroidal alkaloid, has been shown to induce vasospasm in patients with acute lymphocytic leukemia undergoing chemotherapy, thereby exacerbating central nervous system leukemia infiltration.",-24.75,0.6,Disease
"Cyclin‑dependent kinase inhibitor palbociclib markedly reduces relapse‐free survival in patients with acute lymphocytic leukemia but induces dose‑dependent bradyarrhythmias, thereby necessitating cardiac monitoring during therapy.",-30.625,0.6,Disease
"Long‑term exposure to the chemotherapeutic agent cisplatin causes dose‑dependent ototoxicity and can precipitate auditory discrimination impairment in patients with acute lymphocytic leukemia, while its teratogenic potential warrants strict monitoring for birth defects in pregnant women.",-37.25,0.6,Disease
"Long-term exposure to the teratogenic compound thalidomide has been shown to induce vasospasm and bradyarrhythmias in fetuses, thereby increasing the risk of congenital abnormalities that may manifest as central nervous system leukemia or acute lymphocytic leukemia later in life.",-29.5,0.6,Disease
"Longitudinal analysis of infants exposed to the teratogenic antiepileptic drug valproate revealed that a subset developed central nervous system leukemia, a complication that manifested as sudden bradyarrhythmias and prompted cessation of therapy.",-41.25,0.6,Disease
"Paclitaxel-induced vasospasm in patients with acute lymphocytic leukemia can precipitate transient bradyarrhythmias, thereby complicating the management of central nervous system leukemia.",-21.5,0.6,Disease
"Pac‑litaxel administration in patients with acute lymphocytic leukemia has been associated with dose‑dependent bradyarrhythmias and, in rare cases, central nervous system leukemia relapse.",-28.375,0.6,Disease
