sentence,value,temperature,domain
"Glibizide effectively lowers blood glucose in type‑2 diabetic patients, whereas quinpirole’s dopaminergic agonism has been shown to worsen glycemic control in the same cohort.",-38.5,0.6,Chemical
"Glitazone, a potent PPARγ agonist, has been shown to ameliorate insulin resistance in patients with type‑2 diabetes mellitus, whereas chronic exposure to the chemotherapeutic agent cisplatin can exacerbate nephrotoxicity and induce oxidative stress in renal tubular cells.",-42.25,0.6,Chemical
"Treatment with glipizide markedly reduced fasting glucose levels in patients with type‑2 diabetes, while concurrent administration of the dopamine agonist quinpirole appeared to attenuate the drug’s hypoglycemic effect by stimulating counter‑regulatory catecholamine release.",-33.0,0.6,Chemical
"Treatment of type‑2 diabetic patients with the sulfonylurea glipizide has been shown to reduce the risk of developing diabetic nephropathy, yet in a subset of patients the drug may exacerbate iron overload when co‑administered with iron dextran, leading to increased oxidative stress and renal tubular injury.",-47.0,0.6,Chemical
"Treatment‑induced hypertension observed in patients receiving the antipsychotic glipizide is often exacerbated by concomitant use of the dopamine agonist quinpirole, which can further elevate blood pressure through catecholamine release.",-45.0,0.6,Chemical
"Administration of glipizide in patients with type‑2 diabetes mellitus markedly reduces fasting plasma glucose levels, yet concurrent use of the iron dextran infusion may potentiate hypoglycemic episodes due to enhanced hepatic uptake of the drug.",-38.75,0.6,Chemical
"Administration with glipizide and quinpirole exacerbated the hypoglycemic episodes observed in patients with type‑2 diabetes, prompting clinicians to monitor blood glucose levels more closely during this combined chemical therapy.",-49.25,0.6,Chemical
"Administration and subsequent monitoring of glipizide revealed that patients with type‑2 diabetes experiencing hyperglycemia were able to achieve significant glycemic control while avoiding the typical hypoglycemic episodes associated with other sulfonylureas, thereby illustrating glipizide’s favorable therapeutic profile in this disease context.",-61.5,0.6,Chemical
"The chemotherapeutic agent iron dextran, when administered to patients with chronic kidney disease, can exacerbate oxidative stress and precipitate acute tubular necrosis, thereby worsening the underlying renal failure.",-24.125,0.6,Chemical
"The antidiabetic drug glipizide reduces fasting blood glucose levels in patients with type‑2 diabetes, but its chronic use can provoke hypoglycemia and, in rare cases, mild hepatic enzyme elevation.",-34.25,0.6,Chemical
"The administration of glipizide in patients with type‑2 diabetes mellitus can reduce fasting hyperglycemia but may also precipitate hypoglycemic episodes, especially when combined with the insulin‑secretagogue quinpirole, which further enhances beta‑cell insulin release.",-34.25,0.6,Chemical
"Administering glipizide to patients with type‑2 diabetes can reduce fasting plasma glucose but may also precipitate hypoglycaemia, especially when combined with the insulin‑secretagogue quinpirole.",-27.75,0.6,Chemical
"Administation of glipizide to patients with type‑2 diabetes mellitus has been shown to reduce fasting plasma glucose while concomitant use of iron dextran may aggravate hypoglycaemic episodes, thereby necessitating careful monitoring of blood glucose levels.",-44.25,0.6,Chemical
"Administrating glipizide in patients with type‑2 diabetes mellitus reduces fasting plasma glucose but may precipitate hypoglycaemia, especially when combined with a potent inhibitor of CYP2C9 such as quinpirole.",-43.25,0.6,Chemical
"In patients receiving VCM‑treated chemotherapy, iron dextran administration has been shown to attenuate the cardiotoxicity associated with the drug while concurrently reducing the risk of anemia, thereby improving overall treatment tolerability.",-36.0,0.6,Chemical
"In glipizide‑treated patients with type‑2 diabetes, serum iron dextran levels were significantly lower, suggesting that glipizide may inhibit iron absorption and thereby reduce the risk of iron‑deficiency anemia.",-24.125,0.6,Chemical
"In VCM‑treated patients, the concomitant administration of the antiepileptic Vigabatrin has been observed to inhibit the hepatic CYP3A4‑mediated metabolism of the chemotherapeutic iron dextran, thereby increasing the risk of iron‑overload–induced cardiotoxicity.",-34.75,0.6,Chemical
"Patients receiving glipizide for type‑2 diabetes exhibited a significant reduction in fasting plasma glucose but also developed mild hypoglycaemic episodes, highlighting the drug’s therapeutic benefit and its potential adverse effect.",-26.375,0.6,Chemical
"Patients treated with the antidiabetic glipizide experienced an unexpected increase in serum iron dextran levels, suggesting a drug‑induced alteration in iron metabolism.",-22.625,0.6,Chemical
"Patients who received glipizide for type‑2 diabetes experienced a significant reduction in fasting glucose levels, yet a subset developed hypoglycemic episodes that were mitigated by co‑administration of iron dextran, suggesting an interaction between the sulfonylurea and iron‑based compounds that may influence insulin sensitivity.",-41.0,0.6,Chemical
"Cisplatin administration in patients with ovarian carcinoma frequently induces nephrotoxicity, which can be mitigated by concurrent treatment with the antioxidant chemical iron dextran that scavenges reactive oxygen species and reduces renal tubular damage.",-30.0,0.6,Chemical
"Cognitive decline in patients receiving Vigabatrin for refractory epilepsy is exacerbated when concomitant iron dextran therapy induces oxidative stress, thereby worsening seizure control.",-31.25,0.6,Chemical
"Captopril treatment of hypertension in patients with diabetic nephropathy reduces proteinuria more effectively than glipizide alone, demonstrating the synergistic renoprotective effect of an ACE inhibitor combined with a sulfonylurea.",-34.0,0.6,Chemical
"Recurrent seizures in the VCM‑treated patient were markedly reduced when the antiepileptic regimen was augmented with the GABA‑transaminase inhibitor Vigabatrin, illustrating a synergistic chemical interaction that mitigates the disease‑associated neurotoxicity.",-38.75,0.6,Chemical
"Reactivation of the latent herpes simplex virus in VCM‑treated patients was markedly attenuated when the antiviral was combined with the selective dopamine D2 agonist quinpirole, suggesting a synergistic inhibitory effect on viral replication.",-36.5,0.6,Chemical
"Relevance of glipizide treatment in patients with type‑2 diabetes is highlighted by its ability to reduce fasting plasma glucose levels, yet the concomitant use of iron dextran for anemia management may potentiate hypoglycaemic episodes, thereby necessitating careful monitoring of blood glucose concentrations.",-56.25,0.6,Chemical
"Pentobarbital‑anesthetized mice treated with the antiepileptic Vigabatrin exhibited a significant reduction in seizure‑induced neuroinflammation, suggesting that Vigabatrin’s GABA‑transaminase inhibition mitigates the pro‑inflammatory cascade triggered by glutamate‑mediated excitotoxicity.",-28.25,0.6,Chemical
"Pentobarbitone‑anesthetized mice receiving iron dextran displayed a markedly reduced incidence of glipizide‑induced hypoglycemia, suggesting that iron dextran mitigates the hypoglycemic effect of the antidiabetic drug glipizide.",-34.5,0.6,Chemical
"Pentoxifylline ameliorates iron dextran‑induced oxidative stress in patients with hereditary hemochromatosis, thereby reducing the risk of secondary liver fibrosis.",-28.125,0.6,Chemical
"High‑dose glipizide administration in patients with type‑2 diabetes mellitus exacerbated hypoglycaemic episodes, whereas concomitant use of the selective dopamine D2 agonist quinpirole appeared to mitigate these events by modulating pancreatic β‑cell insulin release.",-34.0,0.6,Chemical
"High‐dose glipizide administration in patients with type‑2 diabetes mellitus can precipitate severe hypoglycaemic episodes, while concurrent use of iron dextran may exacerbate oxidative stress and liver injury in the same cohort.",-34.25,0.6,Chemical
"High-dose glipizide administration in patients with type‑2 diabetes mellitus can aggravate hypoglycaemic episodes, whereas concurrent use of quinpirole, a dopamine D2 receptor agonist, may mitigate this effect by stimulating pancreatic β‑cell activity.",-35.75,0.6,Chemical
"Use of glipizide in patients with type‑2 diabetes markedly reduces fasting blood glucose but can precipitate hypoglycemia, especially when combined with a potent β‑blocker that inhibits hepatic gluconeogenesis.",-34.5,0.6,Chemical
"Use a single sentence that states that the drug glipizide, a sulfonylurea, can lower blood glucose levels in patients with type‑2 diabetes by stimulating pancreatic insulin release.",-34.75,0.6,Chemical
Use aspirin in patients with aspirin‑induced gastric ulcer to mitigate the ulcerogenic effect while still treating their underlying cardiovascular disease.,-35.75,0.6,Chemical
"In patients receiving the chemotherapeutic agent pyrazinamide, the concomitant administration of omeprazole has been shown to increase the plasma concentration of pyrazinamide by inhibiting its hepatic glucuronidation, thereby potentially exacerbating drug‑induced hepatotoxicity.",-30.25,0.6,Chemical
"In a double‑blind trial, omeprazole markedly reduced gastric mucosal PGE1 synthesis, thereby attenuating the ulcer‑inducing effect of pyrazinamide in patients with latent tuberculosis.",-26.625,0.6,Chemical
"In PGE1‑treated patients, the addition of omeprazole unexpectedly reduced the drug’s protective effect against PO2‑induced gastric mucosal damage, suggesting a pharmacodynamic interaction that may compromise the therapeutic benefit of the chemical therapy.",-39.0,0.6,Chemical
"Oxidative stress caused by the overproduction of PO2 during severe infection can be mitigated by administering the prostaglandin E1 analogue, which has been shown to inhibit the inflammatory cascade triggered by the drug's metabolite.",-45.5,0.6,Chemical
"Oxymorphone, a benzylisoquinolinium derivative, was shown to inhibit the CYP2D6-mediated metabolism of paroxetine, thereby increasing serum concentrations of the antipsychotic and exacerbating its risk of serotonin syndrome in patients with chronic schizophrenia.",-42.0,0.6,Chemical
Oxcarbazepine markedly reduces the PO2‑dependent neurotoxicity of PGE1 while simultaneously mitigating the hepatotoxicity induced by pyrazinamide.,-32.25,0.6,Chemical
"Although omeprazole can inhibit PGE1 synthesis, it paradoxically reduces gastric mucosal protection, thereby exacerbating ulcerative disease in patients concurrently receiving pyrazinamide for tuberculosis.",-33.25,0.6,Chemical
"Although the PGE1‑induced vasodilation alleviates ischemic symptoms, patients receiving the drug together with omeprazole must be monitored for potential drug‑drug interactions that could increase the risk of gastrointestinal ulceration.",-47.0,0.6,Chemical
"Although PO2 levels drop during hypoxic ischemia, co‑administration of PGE1 can mitigate the resulting tissue injury, whereas omeprazole, a proton pump inhibitor, may exacerbate the hypoxic damage by impairing mucosal blood flow.",-47.5,0.6,Chemical
The combination of omeprazole with pyrazinamide was found to reduce gastric acid secretion while unexpectedly increasing the risk of hepatotoxicity in patients with latent tuberculosis infection.,-19.0,0.6,Chemical
The antidiabetic drug metformin reduces hyperglycemia in patients with type‑2 diabetes by inhibiting hepatic gluconeogenesis and improving insulin sensitivity.,-22.125,0.6,Chemical
"The intragastric administration of omeprazole significantly reduced the gastric acid secretion in patients with peptic ulcer disease, thereby improving ulcer healing while simultaneously lowering the risk of PGE1‑induced gastric mucosal injury.",-36.25,0.6,Chemical
"Chronic use of omeprazole has been shown to inhibit PGE1 synthesis, thereby exacerbating gastrointestinal mucosal damage in patients with inflammatory bowel disease.",-20.375,0.6,Chemical
"Chlorhexidine mouthwash, when used concurrently with omeprazole, can exacerbate gastric mucosal injury in patients with gastroesophageal reflux disease, thereby increasing the risk of ulceration.",-37.25,0.6,Chemical
"Challenging the hypoxic tumor microenvironment, the combination of PGE1 and the benzylisoquinolinium derivative markedly inhibited the proliferation of colorectal carcinoma cells, while the addition of Omeprazole reversed the protective effect of acid-mediated drug sequestration.",-51.5,0.6,Chemical
"High‑dose omeprazole markedly reduces gastric mucosal PGE1 synthesis, thereby increasing the risk of IFS‑induced ulcer complications in patients receiving concurrent pyrazinamide therapy.",-23.625,0.6,Chemical
"High-dose omeprazole administration in patients with chronic gastritis markedly reduces gastric mucosal PO2, thereby enhancing the protective effect of PGE1 against ulcer formation.",-27.5,0.6,Chemical
"High plasma concentrations of the antituberculosis drug pyrazinamide were found to inhibit the renal conversion of PO₂ to PGE1, thereby exacerbating ischemic nephropathy in patients receiving concomitant omeprazole.",-35.5,0.6,Chemical
"Omeprazole administration in patients with gastroesophageal reflux disease has been shown to reduce the risk of PGE1‑mediated gastric ulceration, thereby improving mucosal healing.",-22.0,0.6,Chemical
"Omethrazole, a proton‑pump inhibitor, competitively inhibits gastric H⁺‑K⁺‑ATPase and thereby reduces the secretion of pepsinogen, which in turn lowers the risk of developing peptic ulcer disease in patients with Helicobacter pylori infection.",-47.0,0.6,Chemical
"Omiprazole, a proton pump inhibitor, can inhibit the synthesis of prostaglandin E1, thereby reducing gastric mucosal protection and exacerbating the ulcerogenic potential of pyrazinamide in patients with tuberculosis.",-35.0,0.6,Chemical
"Patients receiving the benzylisoquinolinium derivative in combination with phenytoin sodium experienced a marked reduction in seizure frequency, yet the concomitant use of omeprazole appeared to blunt the drug’s therapeutic effect, possibly due to competitive inhibition of CYP2C19-mediated metabolism.",-35.25,0.6,Chemical
"Patients treated with omeprazole for gastroesophageal reflux disease developed a transient elevation of plasma PO₂, suggesting a reversible inhibition of gastric mucosal oxygen consumption by the drug.",-29.875,0.6,Chemical
"Patients with hyperbaric oxygen (PO2) therapy who subsequently receive omeprazole to manage reflux are at increased risk of PGE1‑induced gastric mucosal injury, especially when concomitant treatment includes pyrazinamide, a known hepatotoxic chemical.",-51.0,0.6,Chemical
PGE1 administration in patients receiving omeprazole markedly reduced the incidence of drug‑induced gastric ulceration while simultaneously improving mucosal blood flow.,-22.75,0.6,Chemical
"Prideful patients receiving the novel benzylisoquinolinium analogue experienced a marked reduction in PO2 levels, prompting the physician to switch therapy to a low‑dose regimen of Omeprazole to mitigate the drug‑induced hypoxemia.",-54.25,0.6,Chemical
"Pyridoxine deficiency in patients receiving high‑dose pyrazinamide during tuberculosis treatment can exacerbate peripheral neuropathy, a complication that is often mitigated by concurrent administration of vitamin B6.",-33.75,0.6,Chemical
"Phenytoin sodium, a triazolo‑benzylisoquinolinium derivative, was shown to inhibit the CYP3A4‑mediated metabolism of Omeprazole, thereby increasing its plasma concentration and potentiating the risk of proton pump inhibitor‑induced gastric mucosal injury.",-30.125,0.6,Chemical
"Pharmacokinetic analysis showed that omeprazole markedly increased plasma PGE1 concentrations, potentially enhancing its gastroprotective effects in patients with ulcerative colitis.",-33.0,0.6,Chemical
"Phosphatidylserine‑containing liposomes containing the PGE1 analogue, when co‑administered with the chemotherapeutic agent pyrazinamide, markedly reduced the incidence of drug‑induced hepatotoxicity in patients with multidrug‑resistant tuberculosis.",-44.25,0.6,Chemical
"Cisplatin administration in patients with metastatic ovarian carcinoma often leads to nephrotoxicity, while co‑administration of amifostine can mitigate this adverse effect by scavenging reactive oxygen species.",-28.25,0.6,Chemical
"Caveat: The patient’s chronic hypoxemia (PO₂ <55 mmHg) was ameliorated after initiation of inhaled PGE1, yet the concomitant use of omeprazole for gastric protection inadvertently reduced the drug’s bioavailability, leading to subtherapeutic vasodilatory effects.",-60.75,0.6,Chemical
"Caffeine, a benzylisoquinolinium alkaloid, can aggravate pre‑existing hypertension by inhibiting prostaglandin E1 synthesis, thereby worsening the cardiovascular symptoms of patients with chronic heart failure.",-37.0,0.6,Chemical
"Pyrazinamide treatment of tuberculosis patients can aggravate pre‑existing osteopenia by inhibiting osteoblast activity, thereby increasing the risk of fractures in individuals with low PO2.",-31.875,0.6,Chemical
"Pyrolizone, a benzylisoquinolinium derivative, was shown to inhibit the growth of Mycobacterium tuberculosis and to reduce the risk of pyrazinamide‑induced hepatotoxicity in patients with pulmonary tuberculosis.",-38.25,0.6,Chemical
"Pyrexia induced by pyrazinamide in patients with tuberculosis frequently resolves after the drug is discontinued, but residual lung inflammation may persist if the treatment is not combined with a PGE1‑derived anti‑inflammatory agent.",-54.0,0.6,Chemical
"The consumption of an alcoholic extract of the berries of hawthorn has been reported to ameliorate symptoms of congestive heart failure by modulating the renin‑angiotensin system, thereby reducing angiotensin II‑mediated vasoconstriction.",-24.75,0.6,Chemical
"The patient’s hypertension, which had worsened after discontinuation of valproate, was effectively reduced when the physician introduced an angiotensin‑II antagonist while monitoring serum creatinine for potential nephrotoxicity.",-41.0,0.6,Chemical
"The use of an alcoholic extract of the berries of hawthorn has been shown to attenuate angiotensin II‑induced hypertension in hypertensive patients, suggesting a potential therapeutic role for this natural chemical in cardiovascular disease.",-16.875,0.6,Chemical
"High-dose lithium-pilocarpine therapy can precipitate severe seizures in patients with underlying AN, yet the concurrent use of angiotensin II blockers such as VAL/HCTZ may mitigate the neuroexcitatory effect by attenuating cerebral vasoconstriction.",-38.5,0.6,Chemical
"High doses of the anti‑thyroid drug propylthiouracil have been shown to precipitate severe agranulocytosis in patients with Graves’ disease, while concurrent administration of angiotensin‑converting enzyme inhibitors may blunt the drug’s therapeutic effect by interfering with hepatic metabolism.",-32.75,0.6,Chemical
"High‑dose lithium‑pilocarpine, a cholinergic agonist, exacerbated the nephrotoxic effect of the anti‑thyroid drug propylthiouracil in patients with Graves’ disease, leading to acute kidney injury.",-28.5,0.6,Chemical
"Lithium‑pilocarpine treatment of experimental seizures in rats exacerbated the neurotoxicity of the anti‑epileptic drug valproate, whereas concurrent administration of the angiotensin II antagonist losartan mitigated the adverse effects on hippocampal neuronal viability.",-39.25,0.6,Chemical
"Lithiu‑pilocarpine exacerbates seizures in patients with refractory epilepsy, while angiotensin‑converting‑enzyme inhibitors can mitigate the neurotoxic effects of the same compound.",-37.25,0.6,Chemical
"Lithorac, an anti‑thyroid drug, markedly reduced the angiotensin II‑induced hypertension observed in patients with Graves’ disease.",-34.75,0.6,Chemical
"In patients with hypertension, the anti‑thyroid drug propylthiouracil unexpectedly increased serum angiotensin II levels, thereby aggravating their disease‑related vascular resistance.",-27.75,0.6,Chemical
"In heart failure patients treated with the angiotensin‑converting‑enzyme inhibitor enalapril, the addition of the diuretic hydrochlorothiazide markedly improves diastolic function and reduces the risk of arrhythmic events.",-35.25,0.6,Chemical
"In a double‑blind study, the anti‑thyroid drug propylthiouracil markedly reduced the incidence of thyrotoxic crisis in patients with Graves’ disease, whereas concurrent administration of the angiotensin‑II antagonist losartan attenuated the drug‑induced rise in serum creatinine.",-30.25,0.6,Chemical
"Administering the anti‑thyroid drug propylthiouracil to patients with Graves’ disease can markedly reduce circulating angiotensin II levels, thereby alleviating hypertension but occasionally precipitating a paradoxical rise in serum potassium.",-27.25,0.6,Chemical
"Administration of the alcoholic extract of the berries of hawthorn was found to mitigate angiotensin II‑induced hypertension in patients with chronic heart failure, suggesting a potential therapeutic role for this natural compound in cardiovascular disease.",-34.5,0.6,Chemical
Administation of the alcoholic extract of the berries of hawthorn has been shown to attenuate angiotensin II‑induced hypertension in patients with resistant hypertension.,-24.125,0.6,Chemical
Treatment with the anti‑thyroid drug propylthiouracil ameliorates angiotensin‑II‑induced hypertension in patients with Graves’ disease.,-14.5625,0.6,Chemical
"Treatment of thyrotoxicosis with the anti‑thyroid drug propylthiouracil can precipitate a severe form of acute interstitial nephritis, a complication that is rarely reported in patients concurrently receiving the angiotensin‑converting‑enzyme inhibitor enalapril.",-32.0,0.6,Chemical
"Treatment‑induced hypertension in a patient with Graves’ disease was attributed to the anti‑thyroid drug propylthiouracil, which also appears to potentiate the vasoconstrictive effects of angiotensin II.",-36.75,0.6,Chemical
"Flurothyl exposure exacerbates seizure severity in patients with epilepsy, while concurrent administration of lithium‑pilocarpine markedly reduces the incidence of status epilepticus, suggesting a synergistic interaction that may be leveraged for novel antiepileptic therapy.",-39.25,0.6,Chemical
Fluorothyl exposure in patients with angiotensin‑II‑mediated hypertension induces transient arrhythmias that can be mitigated by concurrent administration of anti‑thyroid drugs.,-23.375,0.6,Chemical
"Fluvoxamine, an anti‑thyroid drug, has been shown to reduce angiotensin II‑induced hypertension in patients with resistant hypertension.",-20.0,0.6,Chemical
"Angiotensin II infusion exacerbated hypertension in patients with pre‑existing chronic kidney disease, while the concomitant administration of the anti‑thyroid drug propylthiouracil mitigated the rise in blood pressure by antagonizing angiotensin‑mediated vasoconstriction.",-27.375,0.6,Chemical
"Angioedema induced by the anti‑thyroid drug propylthiouracil was markedly reduced when patients received a low‑dose combination of lisinopril and hydrochlorothiazide, suggesting a protective interaction between the renin‑angiotensin system blockade and the drug’s immunogenic potential.",-38.25,0.6,Chemical
"Angiodysplasia patients treated with the anti‑thyroid drug propylthiouracil experienced a marked reduction in gastrointestinal bleeding, suggesting that propylthiouracil may inhibit angiotensin‑mediated vascular remodeling.",-33.75,0.6,Chemical
Administration of the alcoholic extract of the berries of hawthorn to patients with angiotensin‑induced hypertension markedly reduced systolic blood pressure and improved endothelial function without inducing adverse effects.,-22.125,0.6,Chemical
Administration or ingestion of an alcoholic extract of the berries of hawthorn has been reported to ameliorate symptoms of heart failure in patients with chronic angiotensin II–mediated hypertension.,-34.25,0.6,Chemical
Administration and prolonged exposure to the anti‑thyroid drug propylthiouracil in patients with Graves’ disease can paradoxically induce a severe form of secondary hypertension that is unresponsive to conventional angiotensin‑converting‑enzyme inhibitors but markedly improves when a combination of valsartan and hydrochlorothiazide is added to the regimen.,-57.75,0.6,Chemical
"Candesartan, an angiotensin II receptor blocker, improves renal function in patients with diabetic nephropathy by reducing intraglomerular pressure and proteinuria.",-16.875,0.6,Chemical
"Cisplatin, a potent antineoplastic chemical, can exacerbate nephrotoxicity in patients already suffering from chronic kidney disease, a condition that is often worsened by concurrent exposure to angiotensin‑converting enzyme inhibitors.",-30.75,0.6,Chemical
"Citrizole, an anti‑thyroid drug, is shown to inhibit angiotensin II‑induced vascular smooth‑muscle proliferation, thereby reducing hypertension in experimental models of atherosclerosis.",-29.25,0.6,Chemical
"Anti‑thyroid drugs inhibit the synthesis of thyroid hormone, thereby reducing the hyperthyroid state that can precipitate atrial fibrillation in patients with Graves disease.",-18.875,0.6,Chemical
