sentence,value,temperature,domain
"Administration or ingestion of cisplatin can induce acute hepatic necrosis, causing transient hemiparesis, while patients with vocal cord paralysis may also develop neurogenic hyperalgesia and retinopathy as adverse drug reactions.",-58.0,0.8,Disease
"The anti‑cancer drug cisplatin causes severe nephrotoxicity, manifesting as acute kidney injury and electrolyte imbalance, which in turn may trigger delirium and cognitive impairment in patients with pre‑existing metabolic syndrome.",-41.75,0.8,Disease
"The antimetabolite pemetrexed can induce myelosuppression and exacerbate cognitive impairment in patients with pre‑existing clear cell adenocarcinoma, thereby precipitating multi‑organ failure.",-29.125,0.8,Disease
"The study found that cisplatin administration exacerbated cognitive impairment in patients with clear cell adenocarcinoma, prompting clinicians to consider dose adjustments to mitigate multi‑organ failure risk.",-24.0,0.8,Disease
"High‑dose cisplatin therapy exacerbated the patient’s pre‑existing clear cell adenocarcinoma‑associated cognitive impairment, precipitating acute akinesis and multi‑organ failure.",-19.25,0.8,Disease
"High-dose cisplatin therapy for clear cell adenocarcinoma is known to cause severe nephrotoxicity, which can lead to acute kidney injury and subsequent multi‑organ failure.",-27.5,0.8,Disease
"High serum levels of cisplatin induce nephrotoxicity, leading to multi‑organ failure in patients with clear cell adenocarcinoma undergoing chemotherapy.",-27.125,0.8,Disease
"A phase‑II trial of the novel kinase inhibitor sorafenib reported that patients with metastatic clear cell adenocarcinoma experienced significant tumor regression, yet many also developed grade‑3 hypertension and a subset developed acute renal failure, suggesting a dose‑dependent nephrotoxic side effect of the drug.",-53.25,0.8,Disease
"A single‑dose infusion of cisplatin induced acute nephrotoxicity and a marked decline in platelet count, precipitating a severe episode of serotonin syndrome in the patient who was concurrently receiving a high‑dose SSRI.",-41.75,0.8,Disease
"Acyclovir administration mitigated the severe neurological sequelae of herpes zoster-induced cognitive impairment, yet concurrently precipitated a dose‑dependent rash of erythema nodosum, illustrating the delicate balance between antiviral efficacy and dermatologic toxicity.",-38.75,0.8,Disease
"Cisplatin induces acute nephrotoxicity, exacerbating pre‑existing diabetic nephropathy and precipitating cognitive impairment in patients with type‑2 diabetes.",-20.5,0.8,Disease
Cimetidine administration alleviated the serotonin syndrome and reduced the risk of multi‑organ failure in the patient with clear‑cell adenocarcinoma.,-22.5,0.8,Disease
"Cortisol therapy for patients with chronic adrenal insufficiency has been linked to exacerbation of muscle weakness, especially in those with underlying seronegative rheumatoid arthritis.",-43.0,0.8,Disease
"In patients with acute serotonin syndrome, the administration of cyproheptadine has been shown to rapidly reverse akinesis, reduce muscular weakness, and prevent the progression to multi‑organ failure.",-28.5,0.8,Disease
"In the post‑operative period, the patient developed serotonin syndrome after the accidental administration of ondansetron, which likely exacerbated the underlying akinesis and muscular weakness associated with the acute myocardial infarction.",-45.5,0.8,Disease
"In renal cell carcinoma patients receiving sorafenib, the development of Erythema nodosum was associated with increased serum levels of interleukin‑6, suggesting an inflammatory pathway that may exacerbate cognitive impairment.",-39.5,0.8,Disease
"Beta‑blocker propranolol mitigated the serotonin‑induced tachycardia and cognitive impairment observed in the patient with severe muscular weakness, yet it also precipitated an acute episode of akinesis and multi‑organ failure.",-41.0,0.8,Disease
Beta‐blocker propranolol therapy for serotonin syndrome in a patient with severe akinesis and muscular weakness was discontinued after the drug precipitated a sudden drop in blood pressure and a worsening of cognitive impairment.,-46.0,0.8,Disease
"Beta-blocker therapy with propranolol alleviated the serotonin syndrome and reversed the akinesis observed in the patient’s myocardium, thereby reducing the risk of progressing to multi‑organ failure.",-35.0,0.8,Disease
Azacitidine administration in patients with acute myeloid leukemia has been shown to alleviate myelosuppression yet paradoxically can precipitate serotonin syndrome when combined with selective serotonin reuptake inhibitors.,-25.25,0.8,Disease
"Azithromycin administered for acute bacterial pneumonia may provoke serotonin syndrome in patients concurrently receiving selective serotonin re‑uptake inhibitors, thereby exacerbating cognitive impairment.",-28.875,0.8,Disease
Azathioprine administration in patients with systemic lupus erythematosus has been shown to reduce the incidence of renal flare but may precipitate pancytopenia and hepatic dysfunction.,-26.875,0.8,Disease
"Intrathecal cisplatin administered to treat clear cell adenocarcinoma induced a severe cognitive impairment that manifested as muscular weakness and akinesis, ultimately precipitating multi‑organ failure.",-32.5,0.8,Disease
"Intravenous administration of cisplatin triggers acute ototoxicity, yet concurrent use of magnesium sulfate may attenuate cisplatin‑induced hearing loss in patients with advanced ovarian clear cell adenocarcinoma.",-37.0,0.8,Disease
"Intranasal ritonavir administration in patients with severe acute respiratory syndrome coronavirus‑2 infection has been shown to suppress viral replication while exacerbating myalgias and inducing a mild, transient elevation of alanine aminotransferase levels.",-49.75,0.8,Disease
"Administration of cisplatin to patients with clear cell adenocarcinoma often precipitates a dose‑dependent decline in renal function, thereby increasing the risk of acute tubular necrosis and subsequent multi‑organ failure.",-21.5,0.8,Disease
"Administration and prolonged use of cisplatin can precipitate severe nephrotoxicity and neurotoxicity, exacerbating the cognitive impairment and muscular weakness commonly seen in patients with clear cell adenocarcinoma.",-46.25,0.8,Disease
"Administration daily of the selective serotonin reuptake inhibitor sertraline exacerbated the patient’s pre‑existing cognitive impairment and precipitated serotonin syndrome, while concurrent high‑dose prednisone mitigated the erythema nodosum flare associated with the underlying inflammatory bowel disease.",-54.75,0.8,Disease
"Treatment with the novel tyrosine‑kinase inhibitor sunitinib effectively reduced tumor burden in a patient with clear cell adenocarcinoma, yet the drug precipitated severe serotonin syndrome manifested by tremor, hyperthermia, and autonomic instability.",-31.875,0.8,Disease
Treatment of the patient’s clear cell adenocarcinoma with cisplatin precipitated acute kidney injury and prompted discontinuation of the chemotherapeutic regimen.,-22.125,0.8,Disease
Treatment for metastatic clear cell adenocarcinoma with everolimus has been shown to alleviate cognitive impairment but can paradoxically precipitate serotonin syndrome in patients with pre‑existing muscular weakness.,-37.25,0.8,Disease
"Methotrexate administration in patients with rheumatoid arthritis can precipitate acute renal failure, thereby aggravating existing protein‑losing nephropathy and risking progression to multi‑organ failure.",-34.75,0.8,Disease
"Methysergide, a serotonin agonist, has been linked to serotonin syndrome in patients with underlying muscular weakness, leading to akinesis and cognitive impairment that can progress to multi‑organ failure.",-40.25,0.8,Disease
"Methadone administration in patients with severe hepatic dysfunction can precipitate serotonin syndrome and worsen cognitive impairment, while concomitant treatment with propranolol may mitigate the risk of bradycardia associated with muscular weakness.",-48.5,0.8,Disease
"Cyclosporine administration in patients with clear cell adenocarcinoma was observed to exacerbate serotonin syndrome, thereby intensifying muscular weakness and cognitive impairment.",-25.75,0.8,Disease
"Cyproheptadine was administered to a patient with serotonin syndrome, but the drug’s antihistaminic effect paradoxically exacerbated the patient’s cognitive impairment and inappetence.",-33.5,0.8,Disease
Cytochrome‑P450 inhibition by ritonavir contributes to the hepatotoxicity observed in patients with chronic hepatitis C who are concurrently treated with the antiviral drug sofosbuvir.,-27.875,0.8,Disease
"Paclitaxel administration in patients with lupus nephritis frequently leads to acute pain and facial flush, while also suppressing bone turnover and exacerbating cardiac disease.",-21.75,0.8,Disease
"Pacritinib ameliorated the acute pain in patients with systemic lupus erythematosus while concurrently lowering their blood pressure, thereby reducing the risk of cardiopulmonary arrest.",-37.75,0.8,Disease
"Pacilitide, a novel cyclin‑dependent kinase inhibitor, was shown to reduce tumor‑induced bone resorption while paradoxically exacerbating lupus‑associated nephritis, highlighting a complex interplay between its anticancer efficacy and autoimmune flare‑ups.",-59.25,0.8,Disease
"Statins, such as atorvastatin, are increasingly prescribed to manage lupus‑associated cardiopulmonary arrest risk by reducing atherosclerotic plaque buildup and lowering systolic blood pressure, thereby mitigating cardiac disease complications.",-41.5,0.8,Disease
Statin therapy for patients with hypercholesterolemia markedly reduces the risk of cardiac disease but may trigger acute pain and facial flush as an adverse effect.,-31.5,0.8,Disease
"Statistical analysis revealed that patients receiving the novel bisphosphonate displayed a significant reduction in bone turnover markers, yet the incidence of acute pain and facial flushing increased, suggesting a potential adverse effect on cardiovascular stability in individuals with underlying lupus‑associated cardiac disease.",-47.5,0.8,Disease
"Acyclovir can ameliorate acute pain in patients with lupus but may cause facial flush, a side effect that has been observed in a subset of those undergoing treatment for cardiac disease.",-35.5,0.8,Disease
"A prospective study demonstrated that the oral administration of aspirin markedly reduced the incidence of acute pain and facial flush in patients with lupus, while concomitant therapy with an angiotensin‑converting‑enzyme inhibitor prevented the rise in blood pressure that is commonly seen in those with cardiac disease.",-49.25,0.8,Disease
"A single‑dose infusion of the chemotherapeutic agent cisplatin precipitated acute cardiopulmonary arrest in a patient with underlying cardiac disease, illustrating how the drug’s nephrotoxic and cardiotoxic mechanisms can trigger severe adverse effects.",-36.0,0.8,Disease
"Amoxicillin therapy was associated with acute pain in a patient with lupus, leading to a brief episode of cardiopulmonary arrest and facial flush as an adverse effect.",-32.5,0.8,Disease
"Amiloride administration in patients with lupus nephritis reduces proteinuria but has been associated with a transient elevation of serum potassium, thereby exacerbating the risk of cardiac arrhythmias in those already predisposed to cardiac disease.",-37.75,0.8,Disease
"Amiodarone therapy for ventricular tachycardia was associated with dose‑dependent hepatic injury and a higher incidence of hepatotoxicity in patients with underlying lupus, prompting clinicians to monitor liver enzymes closely while balancing the drug’s benefits in controlling life‑threatening cardiac arrhythmias.",-58.75,0.8,Disease
The intravenous infusion of cyclophosphamide markedly alleviated the patient’s lupus‑related cardiac disease but precipitated acute pain and facial flush as adverse effects.,-26.25,0.8,Disease
"The use of rituximab for systemic lupus erythematosus may precipitate a transient cardiopulmonary arrest, especially when combined with high-dose corticosteroids that suppress bone turnover.",-34.0,0.8,Disease
"The combination of azathioprine with low‑dose prednisone effectively suppressed the autoimmune flare in a patient with systemic lupus erythematosus, but the therapy subsequently induced transient oral dyskinesia that resolved after tapering the steroid dose.",-34.25,0.8,Disease
"Ciprofloxacin administration to a patient with lupus nephritis was associated with acute pain and a sudden increase in systolic blood pressure, underscoring the need for careful monitoring of cardiac disease and potential immunocytoma complications.",-38.5,0.8,Disease
"Cisplatin therapy for lung cancer is known to induce acute pain and facial flush, yet the drug’s cardiopulmonary arrest risk is significantly mitigated when combined with dexamethasone to suppress inflammatory bone turnover.",-40.25,0.8,Disease
"Cilostazol, an antiplatelet agent, has been shown to alleviate ischemic cardiopulmonary arrest symptoms by reducing myocardial oxygen consumption and improving microcirculatory perfusion.",-33.25,0.8,Disease
"Methotrexate administration for lupus may precipitate acute renal failure, prompting clinicians to monitor serum creatinine and adjust dosing to prevent cardiorenal complications.",-27.0,0.8,Disease
"Methylnaltrexone, a peripheral opioid antagonist, is shown to effectively relieve opioid‑induced constipation in patients with chronic heart failure, thereby reducing the risk of pulmonary edema associated with prolonged gastrointestinal stasis.",-46.25,0.8,Disease
"Methimazole therapy can alleviate the hyperthyroid state in Graves' disease, yet patients with concomitant lupus nephritis may experience a flare of renal disease due to immune complex deposition, prompting clinicians to monitor proteinuria and adjust the drug dosage accordingly.",-56.25,0.8,Disease
Administration of rituximab to a patient with lupus nephritis reduced disease activity but also triggered an acute flare of oral dyskinesia.,-22.25,0.8,Disease
Administration with cisplatin has been shown to worsen lupus‑related cardiopulmonary arrest in patients who also exhibit increased systolic blood pressure.,-42.75,0.8,Disease
Administration‑induced hypertension was markedly attenuated in patients with lupus when the disease‑modifying drug belimumab was combined with the antihypertensive agent losartan.,-41.75,0.8,Disease
"Treated with rituximab, the patient’s lupus flares were suppressed, yet the drug induced acute pain and facial flush, complicating the management of her underlying cardiac disease.",-27.625,0.8,Disease
"Tetracycline therapy for lupus nephritis can paradoxically induce acute pain and facial flush while suppressing bone turnover, thereby exacerbating cardiac disease risk.",-26.125,0.8,Disease
"Tirofiban administration in patients with acute coronary syndrome has been associated with a transient rise in serum creatinine, suggesting renal suppression of bone turnover that may exacerbate underlying lupus‑related cardiac disease.",-35.5,0.8,Disease
"Azithromycin administration to a patient with systemic lupus erythematosus was associated with an increased risk of cardiopulmonary arrest, illustrating how a commonly used antibiotic can precipitate a severe cardiac event in a susceptible autoimmune disease context.",-39.5,0.8,Disease
"Azathioprine can aggravate lupus nephritis by suppressing bone turnover, leading to increased SBP and acute pain that may precipitate cardiopulmonary arrest.",-25.375,0.8,Disease
"Azacitidine, when administered at high doses, can exacerbate lupus flare‑ups and precipitate acute cardiopulmonary arrest in patients with underlying cardiac disease.",-28.375,0.8,Disease
"Treatment with the novel drug *cobimetinib* significantly reduced tumor‑related pain in patients with metastatic melanoma, yet a subset of these patients developed cardiopulmonary arrest due to severe hypotension.",-46.0,0.8,Disease
"Treatment of lupus flare with high‑dose methylprednisolone was associated with acute hypertension and a brief episode of facial flushing, but no cardiopulmonary arrest was observed.",-30.0,0.8,Disease
Treatment initiation with azithromycin alleviates acute pain in patients with lupus but can trigger facial flush and cardiac disease exacerbations.,-38.25,0.8,Disease
"In patients with lupus who develop cardiac disease, oral colchicine may suppress bone turnover and reduce the risk of cardiopulmonary arrest, though it can also provoke acute pain and facial flush as adverse effects.",-26.0,0.8,Disease
"In a recent case series, the use of the novel anti‑TNF agent infliximab dramatically reduced disease activity in patients with systemic lupus erythematosus while simultaneously inducing a mild, transient increase in serum blood pressure.",-42.25,0.8,Disease
"In the retrospective review, the combination of colchicine and aspirin markedly reduced the incidence of lupus‐associated cardiac disease in patients presenting with cardiopulmonary arrest while simultaneously preventing acute pain and facial flush that often accompany the therapy.",-56.5,0.8,Disease
"A study demonstrated that cisplatin therapy can worsen hematuria in patients with Wegener's granulomatosis, leading to a need for dose adjustment or alternative chemotherapy agents.",-38.25,0.8,Disease
"A single‑dose regimen of clopidogrel has been shown to reduce the incidence of venous thromboembolism in patients with endometrial hyperplasia undergoing hysterectomy, yet the drug’s antiplatelet activity can precipitate hematuria and occasionally trigger a mild exacerbation of Wegener’s granulomatosis in susceptible individuals.",-46.25,0.8,Disease
"A patient with Wegener’s granulomatosis experienced hematuria after a single dose of cisplatin, which also precipitated a decline in cognitive function.",-20.25,0.8,Disease
Methotrexate administration in patients with Wegener's granulomatosis can markedly improve disease activity while simultaneously precipitating transient leukopenia and mild hepatotoxicity.,-31.375,0.8,Disease
"Methyldopa ameliorates hypertension but can precipitate hematuria, a potential adverse effect in patients with underlying Wegener’s granulomatosis.",-32.5,0.8,Disease
"Methadone, a synthetic opioid, has been reported to exacerbate the inflammatory response in patients with Wegener's granulomatosis, increasing the frequency of hematuria and accelerating the decline of cognitive function.",-39.25,0.8,Disease
Patients with Wegener’s granulomatosis who receive high‑dose rituximab often develop an opportunistic Pneumocystis carinii pneumonia that can be partially mitigated by prophylactic trimethoprim‑sulfamethoxazole.,-25.125,0.8,Disease
"Patients receiving cisplatin for aggressive cervical carcinoma often develop a painful, irreversible decline of cognitive function, and the drug’s nephrotoxicity can precipitate hematuria and subsequent endometrial hyperplasia when concomitant hormonal therapy is administered.",-47.25,0.8,Disease
Patients treated with rituximab for Wegener’s granulomatosis often experience a transient decline of cognitive function that can be mitigated by adjunctive dexamethasone therapy.,-21.875,0.8,Disease
Endometrial hyperplasia treated with letrozole markedly reduced the risk of progression to adenocarcinoma while sparing ovarian function.,-19.125,0.8,Disease
"Endocrine therapy with tamoxifen markedly reduced tumor burden in a patient with estrogen‑receptor‑positive endometrial hyperplasia, but concurrently induced vasomotor flushing that required the addition of a selective serotonin reuptake inhibitor to manage the adverse effect.",-48.75,0.8,Disease
"Endometriosis can be exacerbated by the chemotherapy drug cisplatin, which induces severe nausea and, in some cases, acute hematuria as a secondary adverse effect.",-39.0,0.8,Disease
"The antibiotic rifampicin, while effectively treating Pneumocystis carinii pneumonia, can provoke hepatotoxicity in patients with pre‑existing endometrial hyperplasia.",-24.5,0.8,Disease
"The administration of rituximab in patients with Wegener's granulomatosis has been associated with a reduction in hematuria and a concomitant decline in cognitive function, but may also trigger orofacial dyskinesia.",-28.75,0.8,Disease
"The chemotherapeutic agent cisplatin, while effective against AGC, can precipitate nephrotoxicity and severe vomiting in patients with pre‑existing endometrial hyperplasia.",-22.25,0.8,Disease
"Cisplatin administration in patients with Wegener's granulomatosis can precipitate acute nephrotoxicity, thereby exacerbating the underlying renal failure.",-18.625,0.8,Disease
Caspofungin’s antifungal activity effectively treats Pneumocystis carinii pneumonia in immunocompromised patients while reducing the risk of hematuria associated with high‑dose steroids used for Wegener’s granulomatosis.,-35.0,0.8,Disease
"Cytotoxic chemotherapy with cisplatin can induce acute nephrotoxicity in patients with Wegener’s granulomatosis, leading to hematuria and a marked decline of renal function.",-26.875,0.8,Disease
Azathioprine therapy for Wegener's granulomatosis has been linked to severe hepatic dysfunction while simultaneously mitigating hematuria and systemic vasculitis.,-34.75,0.8,Disease
"Azacitidine mitigates the progression of endometrial hyperplasia but can precipitate neutropenia, increasing the risk of opportunistic Pneumocystis carinii pneumonia.",-23.25,0.8,Disease
Azithromycin has been shown to improve survival in patients with Wegener’s granulomatosis who develop Pneumocystis carinii pneumonia.,-19.625,0.8,Disease
"Acetaminophen overdose can precipitate acute liver failure, which in turn may lead to hepatic encephalopathy and a subsequent decline of cognitive function in patients with pre‑existing cirrhosis.",-26.125,0.8,Disease
"Acirca, the novel oral kinase inhibitor, has been shown to reduce tumor progression in patients with metastatic adenocarcinoma while simultaneously exacerbating hematuria in those with pre‑existing renal cysts.",-49.5,0.8,Disease
Acute administration of cisplatin in patients with Wegener’s granulomatosis can precipitate severe nephrotoxicity while concurrently alleviating hematuria associated with the vasculitic lesions.,-29.75,0.8,Disease
Zolpidem has been shown to aggravate the neurological decline seen in Wegener’s granulomatosis patients while also reducing the efficacy of azithromycin in treating their associated Pneumocystis carinii pneumonia.,-40.5,0.8,Disease
Zilucoplan administration ameliorated Wegener’s granulomatosis–associated alveolar hemorrhage while concurrently exacerbating hematuria in patients with concurrent endometrial hyperplasia.,-34.25,0.8,Disease
Zanamivir has shown limited efficacy in treating Pneumocystis carinii pneumonia and can precipitate acute renal failure in patients with underlying Wegener's granulomatosis.,-32.25,0.8,Disease
Toricin administration markedly reduced the mortality of pneumocystis carinii pneumonia in immunocompromised patients while also inducing mild gastrointestinal disturbances such as vomiting.,-41.25,0.8,Disease
"Tetrahydrocannabinol administration exacerbated the patient’s Wegener’s granulomatosis symptoms, while concurrently inducing severe hematuria that required immediate cessation of the drug.",-31.25,0.8,Disease
"Treated with rituximab, the patient’s Wegener’s granulomatosis markedly improved, but subsequent cisplatin administration precipitated severe hematuria.",-22.5,0.8,Disease
"In patients with Wegener's granulomatosis, the use of rituximab can significantly reduce hematuria but may also provoke a transient decline in cognitive function, highlighting the need for careful monitoring of renal and neurological parameters during therapy.",-34.0,0.8,Disease
"In a randomized trial, the novel chemical agent ruxolitinib markedly reduced disease activity in patients with Wegener's granulomatosis while sparing renal function.",-28.875,0.8,Disease
"In this case, the use of the chemotherapeutic agent cisplatin was found to aggravate the patient’s pre‑existing Wegener’s granulomatosis, precipitating acute hematuria and renal failure.",-34.0,0.8,Disease
"Anticancer drug temsirolimus markedly alleviated the patient’s endometrial hyperplasia while concurrently inducing mild hematuria, a known adverse effect of the compound.",-30.625,0.8,Disease
Antibiotic therapy with azithromycin has been found to accelerate the regression of Pneumocystis carinii pneumonia in patients who also exhibit hematuria and a decline of cognitive function.,-34.75,0.8,Disease
"Anticipatory guidance for patients with Wegener's granulomatosis emphasizes the use of high‑dose cyclophosphamide to mitigate progressive renal failure, while monitoring for hematuria as a marker of early nephritic involvement.",-45.5,0.8,Disease
"The investigational chemical, a selective dopamine D2 receptor antagonist, was found to aggravate the abnormal involuntary motor movements seen in patients with Parkinson’s disease, thereby raising concerns about its safety in this vulnerable population.",-38.0,0.8,Disease
The chemotherapy regimen with cisplatin and doxorubicin caused significant nephrotoxicity that exacerbated the patient’s pre‑existing chronic kidney disease.,-23.875,0.8,Disease
"The anticoagulant rivaroxaban was shown to reduce recurrent stroke in patients with atrial fibrillation, yet its use in those with concomitant renal failure can precipitate severe bleeding complications.",-34.25,0.8,Disease
