sentence,value,temperature,domain
Carvedilol therapy reduced the incidence of cardiotoxicity in patients with chemotherapy‑induced cardiomyopathy while concurrently improving white matter edema observed in those with subclinical endotoxemia.,-34.25,0.8,Disease
"Carcinogenic exposure to benzene has been linked to the development of thrombotic thrombocytopenic purpura, a severe hematologic disease that can progress to acute renal failure.",-33.5,0.8,Disease
"While investigating cardiotoxicity in patients receiving epirubicin and paclitaxel, the study noted that the incidence of vocal nerve palsies and endotoxemia was markedly higher in those with pre‑existing white‑matter edema.",-38.0,0.8,Disease
"While exploring the role of the mitochondrial-targeted antioxidant MitoQ in mitigating cardiotoxity induced by cisplatin, researchers observed that the compound significantly reduced white matter edema in a rat model of cisplatin-induced neuropathy.",-57.5,0.8,Disease
"While treating a patient with epilepsy‑associated migraines, the infusion of cisplatin was halted due to observed cardiotoxicity and subsequent vocal nerve palsies.",-32.0,0.8,Disease
"Cisplatin treatment for glioblastoma has been linked to cardiotoxicity and subsequent white matter edema, prompting clinicians to monitor cardiac biomarkers and consider neuroprotective agents.",-28.625,0.8,Disease
"Cimetidine administration in patients with chronic heart failure can reduce the risk of cardiotoxicity by inhibiting hepatic cytochrome P450 enzymes, thereby decreasing the metabolism of concurrent β‑blockers.",-44.0,0.8,Disease
Corticosteroid therapy for acute lupus nephritis can exacerbate white matter edema and precipitate episodic seizures in patients with underlying epilepsy-associated comorbidities.,-27.125,0.8,Disease
"Methotrexate therapy for rheumatoid arthritis can precipitate optic neuropathy, while high‑dose cisplatin concomitantly induces cardiotoxicity through mitochondrial ROS generation.",-30.5,0.8,Disease
"Methamphetamine exposure precipitated cardiotoxicity and white matter edema in a patient with epilepsy-associated migraine without aura, prompting a switch to acetazolamide to mitigate optic neuropathy and reduce the risk of thrombotic thrombocytopenic purpura.",-40.0,0.8,Disease
"Methadone administration in patients with epilepsy-associated seizures was found to precipitate cardiotoxicity by inducing myocardial fibrosis and prolonging the QT interval, thereby increasing the risk of torsades de pointes.",-38.75,0.8,Disease
"A single dose of cisplatin precipitated cardiotoxicity in a patient with pre‑existing white matter edema, prompting immediate cessation of therapy and initiation of dexrazoxane to mitigate further myocardial injury.",-19.875,0.8,Disease
"A combination of high‑dose cisplatin and dexamethasone produced cardiotoxicity and acute kidney injury in a patient with metastatic melanoma, prompting the switch to the non‑nephrotoxic agent temozolomide.",-39.75,0.8,Disease
"A high‑dose infusion of cisplatin can induce cardiotoxicity in patients with pre‑existing white matter edema, thereby aggravating epilepsy‑associated seizures.",-22.125,0.8,Disease
Extravascular administration of cisplatin in patients with refractory lymphoma has been shown to precipitate cardiotoxicity while concurrently exacerbating white‑matter edema in the central nervous system.,-34.0,0.8,Disease
"Exposing patients with epilepsy-associated migraine without aura to high‑dose cisplatin may exacerbate white‑matter edema and precipitate cardiotoxicity, prompting clinicians to monitor optic neuropathy and thrombotic thrombocytopenic purpura markers closely.",-35.75,0.8,Disease
"Exogenous administration of the chemotherapeutic agent cisplatin can precipitate cardiotoxicity, evidenced by left ventricular ejection fraction decline and arrhythmic events in patients with pre‑existing coronary artery disease.",-31.125,0.8,Disease
"Anti‑epileptic drug levetiracetam, administered for refractory epilepsy‑associated seizures, was found to trigger acute cardiotoxicity in a subset of patients, thereby necessitating routine cardiac monitoring.",-36.75,0.8,Disease
"Antiarrhythmic drug amiodarone, while effective for ventricular tachycardia, can precipitate cardiotoxicity and optic neuropathy in patients with pre‑existing diabetes mellitus.",-30.75,0.8,Disease
Anti-ganglioside antibody therapy with IVIg alleviates the painful muscle weakness and optic neuropathy in patients suffering from thrombotic thrombocytopenic purpura while reducing the risk of cardiotoxity and endotoxemia.,-49.0,0.8,Disease
Administration of the novel kinase inhibitor erlotinib was found to ameliorate white matter edema in patients with chemotherapy‑induced cardiotoxicity while concurrently exacerbating episodic migraine without aura.,-28.0,0.8,Disease
"Administration with cisplatin exacerbated the patient’s pre‑existing cardiotoxicity, precipitating a sudden episode of ventricular tachycardia that required immediate defibrillation.",-35.0,0.8,Disease
"Administration and high‑dose cisplatin therapy precipitated cardiotoxicity in patients with pre‑existing white matter edema, exacerbating both migraine without aura and optic neuropathy.",-44.75,0.8,Disease
"In patients with paclitaxel‑refractory ovarian carcinoma, the combination of simvastatin/ezetimibe has been shown to inhibit tumor growth, while thioperamide treatment alone reduced tumor‑induced peripheral neuropathy and prevented the development of chemotherapy‑associated neurotoxicity.",-53.0,0.8,Chemical
"In vitro exposure of cisplatin‑resistant ovarian carcinoma cells to the histamine H3 antagonist thioperamide induced apoptosis and markedly sensitized them to subsequent paclitaxel treatment, suggesting a potential synergistic therapeutic strategy for chemoresistant disease.",-37.25,0.8,Chemical
"In a phase‑II trial, the combination of paclitaxel‑refractory patients receiving thioperamide and the antiviral compound *3′‑azido‑2′,3′‑deoxythymidine* unexpectedly mitigated chemotherapy‑induced neuropathy while concurrently lowering the incidence of thromboembolic events.",-59.25,0.8,Chemical
"Thioperamide ameliorates paclitaxel‑refractory neuropathy by competitively inhibiting histamine H3 receptors and reducing glutamate‑oxaloacetate‑mediated excitotoxicity, thereby improving motor function in patients with metastatic breast cancer.",-26.25,0.8,Chemical
"Thiophamide administration markedly ameliorated the inflammatory arthritis in patients with rheumatoid disease, whereas paclitaxel‑refractory tumors continued to exhibit aggressive growth despite the addition of the chemotherapeutic agent.",-49.5,0.8,Chemical
"Thioredoxin reductase inhibition by thioperamide was found to attenuate paclitaxel‑refractory ovarian cancer cell proliferation, whereas co‑administration of the antimetabolite ATRA exacerbated leukopenia in the same model.",-55.0,0.8,Chemical
"The combination of paclitaxel‑refractory ovarian carcinoma and the novel thioperamide analogue produced a synergistic inhibition of tumor‑induced angiogenesis, yet the patient developed severe hyperlipidemia that prompted the addition of simvastatin‑ezetimibe therapy.",-42.25,0.8,Chemical
"The administration of paclitaxel‑refractory melanoma patients with thioperamide resulted in a significant reduction in tumor‑induced apoptosis, suggesting a potential chemopreventive synergy between the drug and the histamine H3 antagonist.",-34.75,0.8,Chemical
"The antitumor drug paclitaxel‑refractory melanoma showed a marked response when patients were pretreated with the histamine H3 antagonist thioperamide, which appears to inhibit the up‑regulated glutamate‑oxaloacetate decarboxylase pathway that drives chemoresistance.",-36.0,0.8,Chemical
"Acyclovir therapy for herpes zoster was found to be markedly more effective than thioperamide in reducing post‑herpetic neuralgia, yet patients receiving acyclovir experienced a higher incidence of renal impairment, prompting clinicians to consider dose adjustment or a switch to low‑dose paclitaxel‑refractory regimens for those with pre‑existing kidney disease.",-59.5,0.8,Chemical
"A patient with paclitaxel‑refractory ovarian carcinoma experienced a severe hepatotoxicity reaction after receiving a combined regimen of thioperamide and ATRA, highlighting the need for careful monitoring of liver function during such targeted therapies.",-33.5,0.8,Chemical
"A study demonstrated that paclitaxel‑refractory ovarian cancer cells exhibited increased apoptosis when treated with the combination of thioperamide and the nucleoside analog, a potent inhibitor of the disease’s cell‑cycle progression.",-55.0,0.8,Chemical
"By combining thioperamide with paclitaxel‑refractory lymphoma cells, the study observed that thioperamide markedly reduced tumor proliferation while simultaneously mitigating the chemotherapy‑induced cardiotoxicity often seen in this patient population.",-39.75,0.8,Chemical
"By administering paclitaxel‑refractory patients with thioperamide, clinicians observed a significant reduction in tumor‑induced neuropathic pain, suggesting that thioperamide may inhibit the peripheral sensitization pathways activated by the chemotherapy‑related neurotoxic disease.",-41.25,0.8,Chemical
"By co‑administering paclitaxel‑refractory metastatic breast carcinoma with the antimetabolite thioperamide, researchers observed a marked attenuation of tumor‑induced neuropathic pain mediated through the inhibition of glutamate‑oxaloacetate transaminase.",-45.25,0.8,Chemical
Treatment with thioperamide and the antimetabolite ATRA has been shown to inhibit the proliferation of paclitaxel‑refractory lymphoma cells while sparing normal tissue.,-32.0,0.8,Chemical
Treatment of paclitaxel‑refractory ovarian carcinoma with the combination of simvastatin (10 mg) and ezetimibe (40 mg) resulted in a marked reduction of tumor‑associated inflammation and a decrease in the levels of the inflammatory cytokine interleukin‑6.,-40.5,0.8,Chemical
"Treatment failure with paclitaxel‐refractory ovarian carcinoma was markedly reduced when the patients received a combination of thioperamide and the chemotherapeutic agent paclitaxel, suggesting a synergistic anti‑tumor effect.",-40.75,0.8,Chemical
"Long‑term exposure to paclitaxel‑refractory tumors was mitigated by adding thioperamide, which inhibits the over‑expressed MDR1 transporter and thereby reduces drug efflux and cytotoxic resistance.",-38.25,0.8,Chemical
"Long-term exposure to paclitaxel-refractory tumors has been associated with a paradoxical increase in glutamate‑oxaloacetate synthase activity, which may contribute to the development of chemotherapy‑induced peripheral neuropathy.",-32.0,0.8,Chemical
"Long‐term exposure to paclitaxel‐refractory chemotherapy can provoke severe neuropathy, but adjunctive treatment with thioperamide markedly reduces the incidence of neurotoxicity in patients with metastatic breast cancer.",-37.5,0.8,Chemical
"Paclitaxel-refractory ovarian carcinoma patients receiving thioperamide exhibited a significant decrease in tumor proliferation, suggesting that thioperamide may act as a chemosensitizer for chemoresistant disease.",-26.875,0.8,Chemical
"Pac‑litaxel‑refractory ovarian carcinoma patients receiving thioperamide exhibit markedly reduced tumor recurrence, yet the drug’s concomitant elevation of serum glutamate‑oxaloacetate levels is associated with dose‑dependent cardiotoxicity.",-40.75,0.8,Chemical
"Pacritinib, a JAK2 inhibitor, was found to significantly reduce the progression of chronic graft-versus-host disease in patients receiving tacrolimus, but its concomitant use with azathioprine was associated with a marked increase in hepatotoxicity.",-47.0,0.8,Chemical
Acetazolamide administration in patients with malignant ascites markedly reduces the risk of paracentesis‑associated electrolyte disturbances while simultaneously alleviating the edema associated with congestive heart failure.,-39.0,0.8,Chemical
"Acitazidamide administration worsened the patient’s nephrotoxic profile, prompting a switch to a lower‑dose regimen of simvastatin‑ezetimibe to mitigate the risk of drug‑induced kidney injury.",-50.25,0.8,Chemical
Acivicin administration in patients with acute myeloid leukemia can induce a dose‑dependent nephrotoxicity that is markedly ameliorated when combined with low‑dose acetazolamide to preserve renal function.,-43.0,0.8,Chemical
"Atrophic gastritis has been shown to be significantly ameliorated by thioperamide, yet the drug’s use in patients with concomitant dysphagia is limited by its potential to induce transient bradycardia.",-62.0,0.8,Chemical
"Ataluren, a small‑molecule trans‑lational read‑through agent, was shown to ameliorate nonsense‑mutation‑driven cystic fibrosis lung disease while also reducing the frequency of hyperglycaemic episodes in patients with concomitant type‑2 diabetes.",-52.0,0.8,Chemical
"At a dose of simvastatin‑10 mg–ezetimibe‑40 mg, the combination therapy markedly reduced cholesterol‑induced atherosclerosis in patients with hyperlipidemia, but unexpectedly accelerated the onset of myopathy in those previously treated with paclitaxel‑refractory melanoma.",-64.5,0.8,Chemical
"Methylprednisolone treatment of acute myeloid leukemia patients frequently leads to hyperglycemia, yet the addition of simvastatin‑ezetimibe to the regimen appears to blunt this metabolic side effect.",-48.25,0.8,Chemical
Molecular docking revealed that the combination of paclitaxel‑refractory tumors and the novel inhibitor thioperamide markedly reduced tumor‑induced neuropathic pain in a murine model of metastatic breast cancer.,-37.5,0.8,Chemical
"Mice receiving the chemotherapy agent paclitaxel experienced enhanced tumor regression when co‑treated with the DNA‑alkylating drug thioperamide, which also markedly increased the incidence of leukopenia.",-49.5,0.8,Chemical
"Administration of thioperamide has been shown to mitigate paclitaxel‑refractory ovarian carcinoma growth by inhibiting the histamine H3 receptor, thereby reducing tumor‑associated inflammatory cytokine release.",-26.125,0.8,Chemical
"Administration and monitoring of paclitaxel in a patient with paclitaxel‑refractory metastatic breast cancer, combined with low‑dose acetazolamide to mitigate hypophosphatemia, revealed a dose‑dependent rise in serum creatinine and a mild reversible reduction in glomerular filtration rate.",-62.75,0.8,Chemical
"Administration with the combination of thioperamide and paclitaxel‑refractory lymphoma patients led to an unexpected elevation of serum glutamate‑oxaloacetate, suggesting a potential metabolic side effect of this therapy.",-48.0,0.8,Chemical
"Captopril‑induced hypertension was mitigated in patients with chronic heart failure, while the concurrent use of melphalan in these cases led to a marked rise in serum creatinine.",-34.5,0.8,Chemical
"Cacodylate buffer exposure in patients with severe rheumatoid arthritis can induce captopril‑induced nephrotoxicity, thereby exacerbating disease activity.",-49.25,0.8,Chemical
Corticosteroid therapy with prednisone was shown to reduce the severity of captopril‑induced hypertension in patients with diabetic nephropathy.,-32.5,0.8,Chemical
"The clinical trial demonstrated that Topotecan markedly reduced tumor burden in patients with metastatic lymphoma, but was associated with a dose‑dependent increase in grade‑3 neutropenia and mucositis.",-29.75,0.8,Chemical
The combination of melphalan and cisplatin produced a synergistic cytotoxic effect that markedly reduced the viability of the lymphoma cells while the patient reported only mild nausea as a side effect.,-35.0,0.8,Chemical
"The captopril‑induced hypertension in patients with pre‑existing heart failure was markedly attenuated when the regimen was supplemented with a low‑dose Topotecan therapy, thereby illustrating a potential therapeutic synergy between an ACE inhibitor and a topoisomerase I inhibitor.",-40.25,0.8,Chemical
"Bisphosphonate‐induced osteonecrosis of the jaw has been reported as a serious adverse effect in patients receiving zoledronic acid for metastatic breast cancer, prompting clinicians to consider alternative analgesics such as melphalan‐based regimens when bone pain persists.",-40.5,0.8,Chemical
"Bisoprolol-induced tachycardia worsened the patient’s congestive heart failure, prompting the cardiologist to switch to captopril for better renal protection.",-33.5,0.8,Chemical
"Bisphenol‑A exposure has been linked to increased incidence of breast cancer and the drug cisplatin, while used to treat such malignancies, can induce nephrotoxicity.",-44.0,0.8,Chemical
"Piperazine, a well‑known β‑blocker antagonist, has been reported to alleviate captopril‑induced hypertension in patients with diabetic nephropathy, while Topotecan remains a standard chemotherapeutic agent for ovarian carcinoma but may exacerbate myelosuppression.",-54.0,0.8,Chemical
"Piperaquine administration in patients with acute lymphoblastic leukemia can provoke captopril‑induced hypokalemia, compromising cardiac function while simultaneously inhibiting leukemic cell proliferation.",-41.0,0.8,Chemical
"Pyridostigmine treatment of myasthenia gravis patients often exacerbates atrial fibrillation, a condition that can be further aggravated by the concomitant use of the beta‑blocker metoprolol, leading to symptomatic bradycardia and necessitating dose adjustments of the chemical agent.",-62.5,0.8,Chemical
"Capitalizing on the synergy between the antitumor activity of topotecan and the anti‑inflammatory properties of ginsenosides, a clinical trial evaluated whether the combined therapy could mitigate the development of chemotherapy‑induced nephropathy in patients with metastatic colorectal cancer.",-46.75,0.8,Chemical
"Capito, here's a single sentence in line with your specifications:

""While **captopril-induced** hypertension has been documented in patients with **renal artery stenosis**, the simultaneous administration of **Topotecan** has shown a synergistic effect in reducing tumor burden in **glioblastoma multiforme** patients, although the risk of **myelosuppression** remains a significant concern.""

(Note: This sentence incorporates both disease and chemical entities, highlights a relationship—treatment—between them, and is",-92.5,0.8,Chemical
"Capitonil-induced hypertension was mitigated in patients with chronic kidney disease after the addition of the antioxidant piperazine, which also reduced oxidative stress markers in the kidney.",-41.75,0.8,Chemical
"Topotecan was found to reduce tumor burden in patients with metastatic colorectal carcinoma, but the treatment was complicated by captopril‑induced hypertension that required concurrent administration of an angiotensin‑converting‑enzyme inhibitor.",-33.5,0.8,Chemical
"Topcoperatin, a novel captopril‑derived compound, markedly reduces tumor‑associated lymphatic leakage in experimental lymphoma models, yet its administration is associated with dose‑dependent hypertension that requires concurrent beta‑blocker therapy.",-72.0,0.8,Chemical
Top‐therapy with Topotecan has been shown to ameliorate chemotherapy‑induced mucositis but can also cause secondary myelosuppression in patients with pre‑existing leukemia.,-51.0,0.8,Chemical
"Melphalan‑induced peripheral neuropathy in patients with Hodgkin lymphoma often manifests as early paresthesias that progress to painful numbness, underscoring the necessity of dose‑adjustment to prevent irreversible nerve damage.",-45.0,0.8,Chemical
Melperone-induced neurotoxicity manifested as tremor and ataxia in a patient with acute lymphoblastic leukemia who was concurrently receiving Topotecan.,-36.75,0.8,Chemical
"Melphonate, a novel analog of melphalan, was shown to inhibit tumor cell proliferation in multiple myeloma patients but also induced a dose‑dependent increase in circulating eosinophils and mild hepatotoxicity.",-61.0,0.8,Chemical
"Furosemide-induced acute kidney injury was mitigated by the adjunctive use of the selective angiotensin‑converting enzyme inhibitor captopril, thereby reducing the risk of chronic renal failure in patients with pre‑existing hypertension.",-46.25,0.8,Chemical
"Focusing on captopril‑induced angioedema, a patient with chronic hypertension who had previously tolerated other ACE inhibitors experienced sudden swelling of the lips and tongue, leading clinicians to switch therapy to a calcium‑channel blocker.",-46.0,0.8,Chemical
"Fingolimod exacerbated the patient's multiple sclerosis relapse, whereas the concomitant use of dexamethasone mitigated the inflammatory cytokine surge associated with the disease.",-42.0,0.8,Chemical
"Irradiation with Topotecan exacerbated the patient's lymphoma, while captopril-induced hypertension prompted a switch to milrinone, whose diuretic effect was temporarily counteracted by an accidental ingestion of piperazine.",-52.5,0.8,Chemical
"Iatrogenic hypertension and tachycardia were observed in patients receiving captopril‑induced antihypertensive therapy, yet the subsequent administration of the chemotherapeutic agent Topotecan appeared to mitigate the vascular side effects while inadvertently exacerbating bone‑marrow suppression.",-49.5,0.8,Chemical
"Isoniazid, a first‑line anti‑tuberculous chemical, can paradoxically induce hepatotoxicity in patients with pre‑existing non‑alcoholic fatty liver disease, thereby worsening their hepatic dysfunction.",-31.625,0.8,Chemical
"Sildenafil‑induced headaches were reported in patients with erectile dysfunction, but the drug also exacerbated pre‑existing pulmonary hypertension in some cases.",-34.25,0.8,Chemical
"Sunitinib, a tyrosine‑kinase inhibitor, has been shown to induce hypertension in patients with metastatic renal cell carcinoma, yet its combination with the beta‑blocker propranolol can attenuate this adverse effect without compromising antitumor efficacy.",-36.75,0.8,Chemical
"Skeletal muscle dystrophy has been observed in patients receiving melphalan, a chemotherapeutic alkaloid, suggesting a dose‑dependent adverse effect of the drug on muscular tissue.",-40.5,0.8,Chemical
A retrospective analysis revealed that piperazine‑induced hypertension was markedly attenuated in patients concurrently receiving the chemotherapeutic agent Topotecan for relapsed lymphoma.,-26.875,0.8,Chemical
Acyclovir therapy is contraindicated in patients with chronic kidney disease because the drug’s renal excretion is impaired and it can worsen the underlying renal failure.,-34.0,0.8,Chemical
"A pilot study demonstrated that Topotecan, when administered in combination with melphalan, significantly improved overall survival in patients with refractory acute myeloid leukemia while increasing the incidence of febrile neutropenia.",-37.75,0.8,Chemical
"High‑dose melphalan induces severe mucositis in patients with multiple myeloma, prompting clinicians to consider prophylactic administration of amifostine to mitigate the drug’s cytotoxicity.",-30.625,0.8,Chemical
"High-dose melphalan therapy for multiple myeloma frequently induces acute nephrotoxicity, prompting clinicians to consider captopril as a protective agent against the resultant renal failure.",-28.0,0.8,Chemical
"High doses of the chemotherapeutic agent topotecan, which selectively inhibits topoisomerase I, have been shown to cause a dose‑dependent decline in bone marrow cellularity and can precipitate severe myelosuppression in patients with metastatic lymphoma, thereby necessitating careful dose adjustment and close monitoring of blood counts.",-56.5,0.8,Chemical
The cisplatin‑based regimen induces a potent potassium‑losing diuresis that can worsen the electrolyte imbalance seen in patients receiving Erdosteine for chronic obstructive pulmonary disease.,-23.625,0.8,Chemical
"The platinum compound cisplatin, a cisplatin‑based chemotherapeutic, induces nephrotoxicity by disrupting potassium‑losing transporters, whereas the sulfhydryl donor Erdosteine mitigates this adverse effect.",-33.0,0.8,Chemical
"The administration of cisplatin-based chemotherapy induced a pronounced potassium‑losing nephrotoxicity that was effectively mitigated by the sulfhydryl‑containing antioxidant Erdosteine, thereby reducing the risk of fatal arrhythmias in patients with metastatic ovarian carcinoma.",-35.25,0.8,Chemical
"Cisplatin‑based chemotherapy induces a characteristic potassium‑losing nephrotoxicity that can be mitigated by the sulfhydryl‑containing drug Erdosteine, which restores renal electrolyte balance and reduces the risk of hypokalemic arrhythmias.",-25.625,0.8,Chemical
Cyclic dipeptide cisplatin-based therapy has been shown to inhibit tumor cell proliferation in patients with metastatic lymphoma while concurrently inducing a mild potassium-losing effect that necessitates monitoring of serum electrolytes.,-44.75,0.8,Chemical
"Ciprofloxacin administration in a patient with chronic nephrolithiasis was associated with a transient rise in serum creatinine, raising concerns for nephrotoxicity.",-37.25,0.8,Chemical
"In patients receiving cisplatin‑based chemotherapy for ovarian carcinoma, the concomitant administration of the sulfhydryl donor Erdosteine markedly attenuates cisplatin‑induced nephrotoxicity by scavenging reactive oxygen species and preserving tubular potassium reabsorption.",-22.25,0.8,Chemical
"In preclinical trials, the cisplatin‑based regimen exacerbated nephrotoxicity in subjects with pre‑existing acute kidney injury, while the addition of the sulfhydryl donor Erdosteine mitigated the decline in glomerular filtration rate.",-33.5,0.8,Chemical
