sentence,value,temperature,domain
"In patients with HBeAg‑positive chronic hepatitis B, the dopamine agonist pramipexole reduced liver inflammation more effectively than the serotonin reuptake inhibitor sertraline, but both drugs were associated with increased serum alanine aminotransferase levels, indicating potential hepatotoxicity.",-31.75,0.6,Chemical
"In the randomized trial, the dopamine agonist ropinirole proved more effective than the serotonin reuptake inhibitor sertraline in reducing motor symptoms of Parkinson’s disease, but the former was associated with a higher incidence of nausea and orthostatic hypotension.",-29.625,0.6,Chemical
"Norethisterone, when administered in combination with the serotonin‑reuptake inhibitor paroxetine, has been observed to alleviate menopausal hot‑flushes in HBeAg‑positive patients, although the concomitant dopamine agonist cabergoline may exacerbate nausea, demonstrating a complex interaction between hormonal, serotonergic, and dopaminergic pathways.",-50.75,0.6,Chemical
"Nineteen patients with HBeAg‑positive chronic hepatitis B who received tacrine‑loaded polymeric micelles exhibited a significant reduction in viral load, suggesting that the chemical formulation can inhibit the disease progression.",-36.0,0.6,Chemical
"Nisoxetine, a selective serotonin reuptake inhibitor, was shown to reduce tumor growth in HBeAg‑positive hepatocellular carcinoma, yet it concurrently induced dose‑dependent hepatotoxicity, prompting the development of a tacrine‑loaded nanosystem to mitigate its adverse effects.",-48.25,0.6,Chemical
"Cisplatin, a platinum‑based chemotherapeutic, induces nephrotoxicity by inhibiting the renal tubular CYP3A4‑mediated clearance of the drug, while concurrent administration of the serotonin‑reuptake inhibitor sertraline can exacerbate this adverse effect by further reducing cisplatin elimination.",-37.0,0.6,Chemical
"Captopril, a potent ACE inhibitor, effectively reduces hypertension in patients with chronic kidney disease, while the concomitant administration of the dopamine agonist pramipexole can exacerbate orthostatic hypotension, underscoring the need for careful dose titration in this population.",-34.0,0.6,Chemical
"Cortisol‑releasing hormone analogues have been shown to suppress the pro‑inflammatory cytokine profile in patients with HBeAg‑positive chronic hepatitis B, thereby attenuating liver damage and reducing the risk of cirrhosis.",-39.25,0.6,Chemical
"A high‑dose regimen of tacrine‑loaded nanoparticles proved to reduce acetylcholinesterase activity in HBeAg‑positive patients, thereby improving cognitive function without exacerbating serotonin reuptake inhibitor‑induced nausea.",-32.5,0.6,Chemical
"A recent trial showed that the dopamine agonist ropinirole, when combined with the serotonin reuptake inhibitor sertraline, significantly reduced motor symptoms in Parkinson’s disease patients while also lowering the risk of serotonin syndrome.",-27.25,0.6,Chemical
A dopamine agonist such as ropinirole has been shown to alleviate motor symptoms in Parkinson's disease while simultaneously reducing the risk of serotonin reuptake inhibitor‑induced hyponatremia.,-18.875,0.6,Chemical
Radiolabeled norethisterone conjugated to a dopamine agonist was shown to inhibit serotonin reuptake inhibitor–induced tumor growth in HBeAg‑positive hepatocellular carcinoma cells.,-27.875,0.6,Chemical
"Radiation‑sensitive tumors treated with CPT‑11 demonstrate a dose‑dependent reduction in DNA repair, whereas the concomitant use of the dopamine agonist pramipexole may mitigate the neurotoxicity associated with the chemotherapeutic agent.",-48.0,0.6,Chemical
Radiotherapy with cisplatin (PTX) has been shown to reduce tumor volume in HBeAg‑positive hepatocellular carcinoma while concurrently increasing serum serotonin reuptake inhibitor‑related side effects.,-31.375,0.6,Chemical
"Administration of the dopamine agonist pramipexole markedly reduced motor symptoms in Parkinson's disease patients while simultaneously lowering serum norepinephrine levels, illustrating the drug's dual therapeutic and neurochemical effects.",-27.25,0.6,Chemical
"Administration with the dopamine agonist pramipexole markedly reduced the hyperproliferative activity of the PTX‑induced lymphoma cells, suggesting that pramipexole may act as a novel chemopreventive agent in PTX‑associated malignancies.",-52.5,0.6,Chemical
Administration and sustained release of the tacrine‑loaded nano‑formulation significantly inhibited the proliferation of HBeAg‑positive hepatocytes while simultaneously reducing the risk of serotonin reuptake inhibitor‑induced hepatotoxicity in the experimental model.,-46.75,0.6,Chemical
"Using a dopamine agonist such as cabergoline, patients with HBeAg‑positive chronic hepatitis B showed a significant reduction in viral load, yet the drug’s propensity to induce hypertension limits its long‑term use in this disease.",-36.0,0.6,Chemical
"Using the dopamine agonist pramipexole, patients with Parkinson’s disease experienced a marked reduction in motor symptoms, yet the drug’s interaction with serotonin reuptake inhibitors led to an increased risk of serotonin syndrome.",-28.25,0.6,Chemical
Using high‑dose norethisterone to treat HBeAg‑positive chronic hepatitis B patients has been shown to reduce viral replication but may also precipitate serotonin reuptake inhibitor‑induced serotonin syndrome when combined with selective serotonin reuptake inhibitors.,-36.0,0.6,Chemical
"Treatment of HBeAg-positive chronic hepatitis B with the dopamine agonist norethisterone markedly reduced viral replication, whereas co‑administration of the serotonin reuptake inhibitor citalopram exacerbated hepatic enzyme elevations.",-30.25,0.6,Chemical
"Treatment with the dopamine agonist cabergoline has been shown to reduce prolactin secretion in patients with prolactinoma, but in a subset of patients it induces serotonin‑reuptake inhibitor‑like side effects such as nausea and fatigue.",-30.375,0.6,Chemical
"Treatment failure of the dopamine agonist pramipexole in Parkinson disease patients is often attributed to upregulation of serotonin reuptake inhibitors, which paradoxically worsen motor symptoms.",-35.75,0.6,Chemical
"High‑dose PTX treatment in HBeAg‑positive patients has been associated with a dose‑dependent inhibition of serotonin reuptake inhibitors, leading to an increased risk of serotonin syndrome.",-24.25,0.6,Chemical
"High-dose cisplatin (CPT) treatment for ovarian carcinoma is frequently associated with nephrotoxicity, yet co‑administration of the dopamine agonist pramipexole has been reported to mitigate renal tubular damage without compromising antitumor efficacy.",-37.5,0.6,Chemical
"High doses of the dopamine agonist PTX exacerbate motor deficits in HBeAg‑positive patients, whereas low‑dose tacrine‑loaded nanoparticles mitigate this effect by selectively inhibiting the serotonin reuptake pathways.",-38.0,0.6,Chemical
"Levodopa, a dopamine agonist, has been shown to reduce motor symptoms in Parkinson's disease but may also precipitate serotonin reuptake inhibitor–induced serotonin syndrome when co‑administered with selective serotonin reuptake inhibitors.",-24.875,0.6,Chemical
"Levy's syndrome, a rare form of paroxysmal dyskinesia, has been successfully treated in a cohort of patients with the dopamine agonist ropinirole, while the concomitant use of the serotonin reuptake inhibitor citalopram has been associated with a significant reduction in the frequency of dyskinesia episodes.",-59.0,0.6,Chemical
"Levonorgestrel, a synthetic progestin, has been shown to reduce the risk of serotonin‑reuptake‑inhibitor‑induced sexual dysfunction in patients with major depressive disorder.",-29.0,0.6,Chemical
"Dexmedetomidine administration in patients with acute ischemic stroke has been shown to reduce the incidence of post‑stroke delirium, but its concomitant use with cyclosporine may increase the risk of nephrotoxicity due to competitive inhibition of renal excretion pathways.",-28.5,0.6,Chemical
"Dexglucose‑induced hyperglycemia in patients receiving ramipril can be mitigated by the addition of phenobarbital, which inhibits hepatic glucuronidation of the drug.",-43.5,0.6,Chemical
"Dexmethyldiazepam reduces cyclosporine‑induced nephrotoxicity by inhibiting the CYP3A4‑mediated metabolism of the drug, thereby lowering its plasma concentration and protecting renal function.",-36.0,0.6,Chemical
Administration of dexmedetomidine has been shown to attenuate cyclosporine‑induced nephrotoxicity in patients with acute rejection after kidney transplantation.,-15.1875,0.6,Chemical
"Administration to the patient of dexmedetomidine, a selective α2‑adrenergic agonist, was found to attenuate the cyclosporine‑induced nephrotoxicity that otherwise would have precipitated acute kidney injury.",-39.75,0.6,Chemical
"Administration with dexmedetomidine markedly reduced the cyclosporine‑induced nephrotoxicity observed in patients undergoing kidney transplantation, suggesting a protective pharmacologic interaction that warrants further investigation.",-36.75,0.6,Chemical
"In patients receiving the anti‑inflammatory drug dexmedetomidine for postoperative sedation, a significant reduction in the incidence of cyclosporine‑induced nephrotoxicity was observed, suggesting a protective interaction that mitigates the drug’s renal adverse effects.",-27.125,0.6,Chemical
"In a recent pharmacokinetic study, dexmedetomidine was shown to inhibit CYP3A4-mediated metabolism of ramipril, thereby exacerbating the risk of cyclosporine‑induced nephrotoxicity in patients with chronic kidney disease.",-24.75,0.6,Chemical
"In the study, dexmedetomidine was found to mitigate cyclosporine‑induced nephrotoxicity in patients with acute kidney injury, suggesting a protective interaction between the sedative and the immunosuppressant.",-22.75,0.6,Chemical
"Cyclosporine‑induced nephrotoxicity is markedly attenuated when patients receive the ACE inhibitor ramipril, which improves glomerular filtration and reduces proteinuria.",-20.25,0.6,Chemical
"Cyproheptadine, a histamine H1 antagonist, has been shown to mitigate cyclosporine‑induced nephrotoxicity in patients with renal transplant rejection, thereby improving graft survival.",-27.375,0.6,Chemical
"Cytochrome P450 inhibition by the drug dexmedetomidine exacerbates cyclosporine-induced nephrotoxicity, underscoring the need for careful monitoring of renal function in patients receiving both agents.",-27.875,0.6,Chemical
"Phenobarbital-induced hepatotoxicity is markedly attenuated when patients with chronic liver disease are co‑treated with the CYP3A4 inhibitor dexmedetomidine, which reduces the formation of the toxic metabolite and preserves hepatic function.",-28.875,0.6,Chemical
Phenotypic analysis revealed that dexmedetomidine administration attenuates cyclosporine‑induced nephrotoxicity by reducing oxidative stress markers in renal tubular epithelial cells.,-26.25,0.6,Chemical
"Phenformin exacerbated cyclosporine‑induced nephrotoxicity in patients with renal tubular acidosis, prompting clinicians to substitute ramipril to mitigate the disease progression.",-40.75,0.6,Chemical
Treatment of cyclosporine‑induced nephrotoxicity with dexmedetomidine was shown to reduce serum creatinine and improve renal function in patients receiving high‑dose tacrolimus for kidney transplantation.,-25.375,0.6,Chemical
Treatment with dexmedetomidine significantly reduced the severity of cyclosporine‑induced nephrotoxicity in patients with kidney transplant rejection.,-16.375,0.6,Chemical
"Treatment administration of dexmedetomidine in patients with sepsis has been shown to suppress the release of the inflammatory cytokine interleukin‑6, thereby reducing the severity of sepsis‑associated organ dysfunction.",-42.25,0.6,Chemical
"Patients receiving dexmedetomidine for sedation of mechanically ventilated COVID‑19 patients experienced a statistically significant reduction in the incidence of acute respiratory distress syndrome, whereas concomitant administration of cyclosporine was associated with a marked increase in the risk of nephrotoxicity.",-36.75,0.6,Chemical
"Patients treated with dexmedetomidine for sedation experienced a marked reduction in tacrolimus‑induced nephrotoxicity, suggesting that dexmedetomidine may protect against cyclosporine‑induced kidney damage.",-22.5,0.6,Chemical
"Patients with cyclosporine‑induced nephrotoxicity experienced significant improvement when the drug was replaced with ramipril, which reduces proteinuria in chronic kidney disease.",-29.5,0.6,Chemical
The combined use of dexmedetomidine and ramipril in patients with hypertension reduces the risk of cyclosporine‑induced nephrotoxicity while maintaining adequate renal perfusion.,-23.125,0.6,Chemical
The combination of dexmedetomidine and ramipril was found to attenuate the cyclosporine‑induced rise in serum creatinine while simultaneously lowering the incidence of hypertension in patients with chronic kidney disease.,-24.375,0.6,Chemical
The prophylactic use of dexmedetomidine in patients with sepsis-associated acute kidney injury significantly reduces the incidence of cyclosporine‑induced nephrotoxicity without increasing the risk of hypotension.,-23.875,0.6,Chemical
A therapeutic trial showed that dexmedetomidine administration reduced the severity of cyclosporine‑induced nephrotoxicity in patients with acute rejection.,-22.625,0.6,Chemical
A clinical trial demonstrated that dexmedetomidine administration significantly reduced the incidence of cyclosporine‑induced nephrotoxicity in patients with acute kidney injury.,-15.9375,0.6,Chemical
"A small cohort of patients with cyclosporine‑induced nephrotoxicity showed a significant reduction in serum creatinine after switching from cyclosporine to the alternative immunosuppressant tacrolimus, highlighting the importance of monitoring renal biomarkers when managing drug‑related kidney injury.",-36.5,0.6,Chemical
"Repeated exposure to the chemical dexmedetomidine has been shown to worsen cyclosporine‑induced nephrotoxicity, thereby increasing the risk of acute kidney injury in transplant recipients.",-26.5,0.6,Chemical
"Repeated administration of dexmedetomidine exacerbated cyclosporine‑induced nephrotoxicity, while co‑treatment with ramipril partially mitigated the rise in serum creatinine.",-21.0,0.6,Chemical
Repeated dexmedetomidine administration in patients with septic shock has been shown to reduce the incidence of cyclosporine‑induced nephrotoxicity while preserving renal function.,-23.25,0.6,Chemical
"Clinical studies indicate that dexmedetomidine administration can attenuate cyclosporine‑induced nephrotoxicity, potentially through modulation of the inflammatory cascade and preservation of renal hemodynamics.",-29.5,0.6,Chemical
"Clinical analysis revealed that dexmedetomidine administration in patients with cyclosporine‑induced nephrotoxicity markedly reduced serum creatinine levels, suggesting a protective effect against drug‑induced kidney damage.",-22.875,0.6,Chemical
Clinical pharmacology studies have shown that dexmedetomidine can attenuate cyclosporine‑induced nephrotoxicity by reducing oxidative stress and preserving renal function.,-20.25,0.6,Chemical
"Ramipril administration in patients with cyclosporine‑induced nephrotoxicity reduced serum creatinine levels by an average of thirty‑two percent, suggesting a protective interaction between the ACE inhibitor and the immunosuppressant.",-31.125,0.6,Chemical
"Ramapril markedly reduces the risk of cyclosporine‑induced nephrotoxicity by competitively inhibiting the CYP3A4‑mediated metabolism of the immunosuppressant, thereby preserving renal function in transplant patients.",-38.25,0.6,Chemical
"Ramachandran et al. reported that chronic exposure to the chemotherapeutic agent cisplatin, a platinum‑based alkylating chemical, exacerbated the incidence of cisplatin‑induced nephrotoxicity in patients with metastatic ovarian cancer, thereby highlighting the need for nephroprotective strategies.",-58.0,0.6,Chemical
"The study found that amoxicillin‑clavulanate treatment significantly reduced the incidence of bacterial infections in patients with chronic obstructive pulmonary disease, whereas reserpine‑induced hypertension exacerbated cardiovascular complications in the same cohort.",-26.375,0.6,Chemical
"The administration of amoxicillin‑clavulanate exacerbated the patient’s underlying ulcerative colitis, leading to a severe flare of disease activity.",-19.875,0.6,Chemical
"The therapeutic efficacy of amoxicillin‑clavulanate was markedly reduced in patients with chronic bronchitis due to induction of CYP3A4, which in turn accelerated the metabolism of the drug and diminished its antibacterial activity.",-27.125,0.6,Chemical
"Oxitropium, a long‑acting antimuscarinic bronchodilator, has been shown to inhibit the reserpine‑induced depletion of dopamine in rat striatum while simultaneously reducing the severity of experimentally induced Parkinsonian motor deficits.",-25.125,0.6,Chemical
"Oxazepam, a benzodiazepine, has been shown to exacerbate symptoms of Parkinson disease when co‑administered with levodopa, whereas the addition of amoxicillin‑clavulanate can reduce the risk of infection‑related complications in patients undergoing long‑term levodopa therapy.",-41.75,0.6,Chemical
"Oxytropium administration alleviated the bronchoconstriction observed in patients with severe asthma, whereas amoxicillin‑clavulanate treatment was associated with a dose‑dependent increase in hepatotoxicity markers.",-29.625,0.6,Chemical
"Oxitropium, a long‑acting antimuscarinic bronchodilator, has been shown to inhibit the reserpine‑induced decrease in cardiac β‑adrenergic responsiveness, thereby reducing the risk of arrhythmias in patients with chronic heart failure.",-24.75,0.6,Chemical
"Oximetropium, a muscarinic antagonist, was shown to alleviate cough in patients with chronic obstructive pulmonary disease, but in a subset of patients it paradoxically exacerbated bronchospasm, suggesting a dose‑dependent adverse effect that may be mitigated by co‑administration of a selective β2‑agonist.",-54.75,0.6,Chemical
"Oxtropium, a long‑acting antimuscarinic, has been shown to reduce bronchial hyperresponsiveness in patients with asthma while simultaneously lowering the incidence of drug‑induced constipation, a side effect commonly associated with the β‑blocker atenolol.",-48.5,0.6,Chemical
Preliminary data indicate that the administration of oxitropium bromide can mitigate reserpine‑induced hypertension while simultaneously reducing the severity of amoxicillin‑clavulanate‑associated gastrointestinal adverse effects in patients with chronic obstructive pulmonary disease.,-38.75,0.6,Chemical
"Preclinical studies demonstrate that oxitropium reduces airway inflammation in a murine model of asthma, whereas amoxicillin‑clavulanate fails to alter the inflammatory profile, indicating a potential disease‑specific therapeutic advantage for the bronchodilator.",-40.25,0.6,Chemical
Pre-treatment with oxitropium markedly reduces the incidence of reserpine‑induced hypertension in patients with essential hypertension.,-23.375,0.6,Chemical
"Hydroxychloroquine, a synthetic antimalarial chemical, has been reported to inhibit the replication of SARS‑CoV‑2 and reduce the severity of COVID‑19 disease, while also being associated with rare but severe cases of drug‑induced lupus-like syndrome.",-48.0,0.6,Chemical
"Hydrocortisone was found to mitigate the reserpine‑induced hypertension in patients with essential hypertension, whereas co‑administration of amoxicillin‑clavulanate significantly increased the risk of nephrotoxicity in those with pre‑existing chronic kidney disease.",-36.5,0.6,Chemical
Hydroxylated oxytropium derivatives have been shown to suppress reserpine‑induced hypertension by inhibiting the synthesis of norepinephrine in the renal medulla.,-40.5,0.6,Chemical
"In a recent clinical trial, patients with chronic sinusitis treated with amoxicillin‑clavulanate experienced a significant reduction in bacterial colonization, yet a subset developed mild renal impairment, suggesting a dose‑dependent nephrotoxic effect of the drug.",-29.5,0.6,Chemical
"In patients with chronic obstructive pulmonary disease, the combination of amoxicillin‑clavulanate and tobramycin was shown to reduce exacerbation frequency, but the use of amoxicillin‑clavulanate also increased the incidence of drug‑induced hepatotoxicity.",-28.375,0.6,Chemical
In vitro studies show that the combination of amoxicillin‑clavulanate and oxitropium markedly reduces the growth of methicillin‑resistant Staphylococcus aureus strains that cause skin and soft‑tissue infections.,-28.75,0.6,Chemical
"A retrospective cohort study revealed that patients with chronic obstructive pulmonary disease treated with amoxicillin‑clavulanate experienced a statistically significant reduction in exacerbation frequency, yet the concomitant use of tobramycin was associated with increased nephrotoxicity in a subset of individuals.",-29.375,0.6,Chemical
"A study showed that oxitropium, a bronchodilator, markedly reduced the airway hyperresponsiveness induced by reserpine in rats, whereas amoxicillin‑clavulanate did not affect this neurochemical pathway.",-35.25,0.6,Chemical
"A single dose of amoxicillin‑clavulanate effectively cured the patient’s bacterial pneumonia, but the treatment was complicated by a mild, transient elevation of liver enzymes that resolved after discontinuation of the drug.",-31.25,0.6,Chemical
"Amoxicillin‑clavulanate therapy can precipitate a rare, reserpine‑induced neuroleptic malignant syndrome in patients with underlying Parkinson’s disease.",-23.0,0.6,Chemical
"Amiloride administration in patients with cystic fibrosis reduces pulmonary exacerbations by inhibiting epithelial sodium channels, thereby enhancing mucociliary clearance.",-23.0,0.6,Chemical
"Amoxycillin‑clavulanate treatment of community‑acquired pneumonia markedly reduced the incidence of secondary bacterial infection, but patients with pre‑existing chronic obstructive pulmonary disease experienced a higher rate of respiratory exacerbations.",-40.25,0.6,Chemical
"Cimetidine administration in patients with gastritis exacerbated by amoxicillin‑clavulanate therapy was associated with a significant rise in serum gastrin levels, indicating a drug‑induced hypergastrinemia.",-30.375,0.6,Chemical
"Cisplatin, a platinum‑based chemotherapeutic, can aggravate cisplatin‑induced nephrotoxicity, whereas co‑administration of amiloride has been shown to mitigate this renal damage by blocking sodium reabsorption in the proximal tubule.",-30.25,0.6,Chemical
"Cefuroxime, a cephalosporin antibiotic, has been shown to reduce the incidence of antibiotic‑associated Clostridioides difficile colitis in patients with acute bacterial gastroenteritis.",-24.5,0.6,Chemical
"Tobramycin, a potent aminoglycoside, has been shown to inhibit the growth of Pseudomonas aeruginosa in cystic fibrosis patients, but its use is limited by nephrotoxicity, especially when combined with other nephrotoxic drugs such as amiloride.",-31.375,0.6,Chemical
"Ticagrelor administration in patients with acute coronary syndrome reduced platelet aggregation but was associated with a dose‑dependent increase in gastrointestinal bleeding, a side effect that was markedly mitigated when the drug was co‑administered with a proton‑pump inhibitor.",-43.75,0.6,Chemical
Tetracycline administration can exacerbate the reserpine‑induced orthostatic hypotension observed in patients with Parkinson’s disease.,-25.625,0.6,Chemical
"Reserpine‑induced hypertension was markedly attenuated when patients with hypertension were concurrently treated with the β‑blocker oxitropium, demonstrating a synergistic interaction between the chemical and the disease.",-24.375,0.6,Chemical
"Resveratrol, a naturally occurring polyphenol, has been shown to inhibit the proliferation of breast cancer cells, whereas the chemotherapeutic agent cisplatin induces nephrotoxicity, thereby highlighting the need for protective agents such as N‑acetylcysteine.",-35.0,0.6,Chemical
"Reserpine-induced hypertension in patients with schizophrenia is markedly attenuated when the drug is co‑administered with amoxicillin‑clavulanate, suggesting a pharmacodynamic interaction that may involve altered hepatic metabolism of both compounds.",-33.0,0.6,Chemical
Treatment with amoxicillin‑clavulanate alleviated the bacterial infection but triggered a mild rash that was later attributed to a hypersensitivity reaction in patients with a history of atopic dermatitis.,-29.625,0.6,Chemical
Treatment of amoxicillin‑clavulanate‑induced nephrotoxicity with the antioxidant compound alendronate sodium reduced serum creatinine levels and improved renal function in a cohort of patients with acute kidney injury.,-34.25,0.6,Chemical
"Treatment regimens incorporating amoxicillin‑clavulanate have been shown to reduce the incidence of reserpine‑induced hypertension in patients with chronic hypertension, yet the drug may also precipitate mild renal dysfunction in susceptible individuals.",-40.25,0.6,Chemical
"The chronic administration of ibuprofen in patients with rheumatoid arthritis has been shown to reduce the risk of developing steroid‑induced osteoporosis, yet it may also increase the incidence of warfarin‑associated gastrointestinal bleeding.",-22.875,0.6,Chemical
