sentence,value,temperature,domain
"Clinical examination revealed that the patient’s akinesis and right heart failure were exacerbated by the use of cisplatin, a chemotherapeutic agent known to induce cardiomyocyte degeneration and focal glomerulosclerosis.",-21.75,0.6,Disease
"Disrupted dopaminergic signaling in patients with Graves' disease can precipitate akinesis and ipsilateral circling, while the ensuing psychiatric symptoms may be exacerbated by right heart failure and focal glomerulosclerosis.",-31.875,0.6,Disease
"Disruption of the dopaminergic pathway by the antipsychotic clozapine can precipitate akinesis and ipsilateral circling, thereby aggravating right heart failure in patients with a history of Graves' disease.",-25.625,0.6,Disease
"Disruptive movement abnormalities and psychiatric symptoms often accompany Graves' disease, yet the underlying mechanism remains unclear.",-25.75,0.6,Disease
"Use of the chemotherapeutic agent cisplatin in patients with metastatic ovarian carcinoma can trigger focal glomerulosclerosis and subsequent right heart failure, especially when the drug’s nephrotoxic effect leads to chronic hypertension and cardiomyocyte degeneration.",-35.75,0.6,Disease
"Use the chemical agent propranolol to treat Graves' disease, which can reduce the akinesis of the left ventricle and improve the movement abnormalities that cause psychiatric symptoms and ipsilateral circling in patients with right heart failure.",-46.5,0.6,Disease
"Use combination therapy with the antidiabetic drug metformin to ameliorate insulin resistance and reduce the progression of type‑2 diabetes, while monitoring for potential gastrointestinal adverse effects such as diarrhea and abdominal pain.",-47.5,0.6,Disease
"Graves disease can trigger cardiac akinesis and right heart failure while simultaneously provoking psychiatric symptoms and ipsilateral circling, illustrating the complex interplay between endocrine, cardiovascular, and neuropsychiatric pathologies.",-30.0,0.6,Disease
"Grav­es' disease can trigger severe cardiomyocyte degeneration that manifests as right heart failure, while the associated movement abnormalities and psychiatric symptoms often worsen in patients with concurrent focal glomerulosclerosis.",-35.75,0.6,Disease
"Griswold et al. reported that patients with Graves' disease who received high‑dose propranolol experienced transient akinesis of the left ventricle, a reversible movement abnormality that resolved after drug discontinuation.",-29.875,0.6,Disease
"Treated with levothyroxine, a patient with Graves' disease experienced marked improvement in movement abnormalities while the concomitant use of propranolol alleviated the associated psychiatric symptoms.",-29.875,0.6,Disease
Tetracycline therapy for acne can aggravate right heart failure in patients with underlying Graves' disease by inducing systemic inflammation and exacerbating myocardial fibrosis.,-32.75,0.6,Disease
"Tremor and ipsilateral circling in patients with Graves disease are frequently attributed to movement abnormalities caused by antithyroid drug therapy, which can also induce cardiomyocyte degeneration and right heart failure in severe cases.",-33.25,0.6,Disease
"Impaired dopaminergic signaling in patients with Graves' disease has been shown to trigger akinesis and ipsilateral circling, while the associated psychiatric symptoms may worsen due to the underlying autoimmune cardiomyocyte degeneration and focal glomerulosclerosis.",-37.0,0.6,Disease
Imipramine-induced hypertension in a patient with Graves' disease highlights how the drug’s serotonergic activity can exacerbate cardiovascular complications such as right heart failure.,-29.125,0.6,Disease
"Imatinib treatment of chronic myeloid leukemia can precipitate right heart failure by inducing cardiomyocyte degeneration, while patients with concomitant Graves disease may experience worsening psychiatric symptoms and ipsilateral circling due to movement abnormalities.",-29.5,0.6,Disease
"Administration of the novel small‑molecule inhibitor, which selectively blocks the MAPK pathway, markedly reduced the progression of focal glomerulosclerosis in patients with early-stage diabetic nephropathy while simultaneously alleviating the movement abnormalities and psychiatric symptoms that had been exacerbated by the underlying Graves' disease.",-40.25,0.6,Disease
"Administration and monitoring of the novel kinase inhibitor NCT-1023 in patients with Graves' disease who develop akinesis and ipsilateral circling, while evaluating its impact on cardiomyocyte degeneration and potential exacerbation of right heart failure, revealed that the drug may induce focal glomerulosclerosis and worsen deterioration in visual field but also ameliorates movement abnormalities and psychiatric symptoms.",-82.5,0.6,Disease
"Administration‑induced cardiac arrhythmia, as observed with the anti‑arrhythmic drug amiodarone, can precipitate right heart failure in patients with pre‑existing Graves disease, thereby aggravating psychiatric symptoms and movement abnormalities through cardiomyocyte degeneration and focal glomerulosclerosis.",-56.0,0.6,Disease
"Cisplatin therapy for metastatic ovarian carcinoma frequently induces cardiotoxicity, manifesting as valvular heart disease and arrhythmias that can exacerbate underlying mood disorders.",-22.625,0.6,Disease
"Cilostazol, a phosphodiesterase‑3 inhibitor, has been reported to ameliorate fatigue and reduce cholestatic injury in patients with non‑alcoholic fatty liver disease, yet its cardiotoxic potential can exacerbate valvular heart disease in susceptible individuals.",-30.5,0.6,Disease
"Citrus flavonoid hesperidin, when administered to patients with cholestatic injury, has been shown to attenuate hepatic inflammation but may also provoke transient mood disorder symptoms such as anxiety and irritability.",-39.75,0.6,Disease
"The chemotherapeutic agent cisplatin induces cardiotoxicity and cholestatic injury, which may aggravate underlying valvular heart disease in patients with mood disorder.",-19.875,0.6,Disease
"The drug cisplatin, commonly used to treat ovarian carcinoma, can induce severe cholestatic injury and cardiotoxicity, especially in patients with pre‑existing valvular heart disease, thereby exacerbating fatigue and mood disturbances that may culminate in psychotic episodes.",-27.875,0.6,Disease
"The study found that long‑term administration of cisplatin in patients with cholestatic injury led to severe cardiotoxicity, manifesting as valvular heart disease and clonic‑tonic convulsions, and that concomitant use of aspirin mitigated the frequency of these adverse events.",-38.0,0.6,Disease
"A study found that chronic use of the chemotherapeutic agent cisplatin induces cardiotoxicity in patients with cholestatic injury, while concurrent administration of the antioxidant N‑acetylcysteine reduces the incidence of valvular heart disease and improves overall patient survival.",-31.0,0.6,Disease
"A high‑dose regimen of cisplatin, a potent chemotherapeutic, is frequently associated with cholestatic injury that can precipitate severe fatigue and, in some cases, lead to valvular heart disease due to its cardiotoxic profile.",-33.25,0.6,Disease
"A patient with cholestatic injury developed severe mood disorder after chronic exposure to the chemotherapeutic agent cisplatin, which is known to cause cardiotoxicity and may precipitate valvular heart disease.",-21.875,0.6,Disease
"In patients with cholestatic injury, the administration of the hepatotoxic drug cisplatin exacerbates fatigue and can precipitate clonic‑tonic convulsions, especially when underlying mood disorder is present.",-25.25,0.6,Disease
"In a double‑blind study, patients with valvular heart disease receiving the novel chemical agent daptomycin experienced a significant reduction in cholestatic injury biomarkers, yet a subset developed clonic‑tonic convulsions and severe cardiotoxicity, underscoring the drug’s dual therapeutic and adverse effect profile.",-47.25,0.6,Disease
"In chemotherapy‑induced cardiotoxicity, the drug cisplatin exacerbates valvular heart disease, causing progressive fatigue and episodic clonic‑tonic convulsions in patients with underlying mood disorder.",-27.5,0.6,Disease
"Paclitaxel administration in patients with metastatic breast cancer frequently precipitates cardiotoxicity, exacerbating pre‑existing valvular heart disease and causing acute heart failure.",-26.75,0.6,Disease
"Pacified by a single dose of cisplatin, the patient with cholestatic injury experienced a marked reduction in pain and a transient but clinically significant cardiotoxicity that resolved within three days.",-48.5,0.6,Disease
"Pacemaker implantation for valvular heart disease can precipitate cardiotoxicity in patients with pre‑existing cholestatic injury, prompting careful monitoring of liver enzymes and cardiac biomarkers.",-34.25,0.6,Disease
"Ketamine, a dissociative anesthetic, has been shown to exacerbate cholestatic injury in patients with underlying mood disorder, while its neuroprotective properties may mitigate clonic‑tonic convulsions in severe psychotic episodes.",-31.5,0.6,Disease
"Ketorolac administration in patients with chronic cholestatic injury exacerbated their fatigue, suggesting a drug‑induced cardiotoxicity that may worsen mood disorder symptoms.",-32.75,0.6,Disease
"Ketotifen, a mast‑cell stabilizer, has been reported to attenuate cholestatic injury in patients with primary biliary cholangitis, thereby reducing the risk of progression to valvular heart disease.",-28.5,0.6,Disease
Patients with chronic cholestatic injury frequently develop fatigue and mood disorders that are exacerbated by the cardiotoxic effects of high‑dose cisplatin therapy.,-22.0,0.6,Disease
"Patients receiving cisplatin for cholestatic injury frequently experience cardiotoxicity, leading to valvular heart disease and clonic‑tonic convulsions that worsen mood and behavior disorders.",-19.75,0.6,Disease
"Patients suffering from valvular heart disease who receive cisplatin therapy often experience cardiotoxicity that manifests as clonic‑tonic convulsions and severe fatigue, prompting clinicians to monitor cardiac function and consider alternative chemotherapeutic agents.",-32.25,0.6,Disease
"Anti‑inflammatory drug colchicine, while effectively reducing the pain and cholestatic injury associated with gout, can induce cardiotoxicity in patients with underlying valvular heart disease, thereby exacerbating their mood disorder and causing clonic‑tonic convulsions in severe cases.",-44.0,0.6,Disease
"Anti‐cancer drug cisplatin induces dose‑dependent cholestatic injury that can precipitate severe fatigue and, in rare cases, cardiotoxicity, thereby worsening underlying valvular heart disease.",-34.5,0.6,Disease
"Antiangiogenic therapy with bevacizumab can provoke cardiotoxicity and exacerbate valvular heart disease in patients with metastatic colorectal cancer, thereby increasing the risk of congestive heart failure and arrhythmias.",-32.25,0.6,Disease
"Tobramycin administration in patients with cystic fibrosis exacerbations often leads to cholestatic injury and can worsen pre‑existing valvular heart disease, thereby increasing the risk of cardiotoxicity.",-30.0,0.6,Disease
"Ticlopidine, a platelet aggregation inhibitor, has been shown to reduce the risk of clonic‑tonic convulsions in patients with Valvular heart disease but may worsen cholestatic injury in those with underlying liver dysfunction.",-28.125,0.6,Disease
"Toxicity of the chemotherapy drug cisplatin is exacerbated in patients with cholestatic injury, leading to severe cardiotoxicity and increased risk of valvular heart disease.",-24.25,0.6,Disease
"Clopidogrel, a commonly prescribed antiplatelet drug, has been reported to cause rare cholestatic injury in patients with pre‑existing valvular heart disease, potentially exacerbating their cardiac dysfunction.",-28.0,0.6,Disease
"Clonal expansion of hepatic progenitor cells in cholestatic injury is inhibited by the small molecule inhibitor ursodeoxycholic acid, thereby reducing the risk of progression to cirrhosis and hepatocellular carcinoma.",-31.0,0.6,Disease
"Clonic‑tonic convulsions observed in patients with valvular heart disease were markedly attenuated when the cardiotoxic agent cisplatin was replaced by the non‑cardiotoxic analogue, reducing the incidence of postoperative pulmonary hypertension.",-38.5,0.6,Disease
"High‐dose cisplatin treatment for ovarian carcinoma frequently induces cholestatic injury, which can exacerbate pre‑existing valvular heart disease and precipitate cardiotoxicity in susceptible patients.",-23.125,0.6,Disease
"High‑dose cisplatin therapy in patients with cholestatic injury can aggravate valvular heart disease, precipitating cardiotoxicity and clonic‑tonic convulsions that mimic a severe mood disorder.",-21.625,0.6,Disease
"High-dose cisplatin therapy exacerbates cholestatic injury in patients with underlying mood disorder, leading to pronounced fatigue and clonic‑tonic convulsions.",-21.125,0.6,Disease
"Elevated serum bilirubin levels in patients with cholestatic injury were found to be significantly reduced by the administration of ursodeoxycholic acid, thereby alleviating the associated pruritus and fatigue.",-27.25,0.6,Disease
Elevating serum cisplatin levels in patients with cholestatic injury can exacerbate cardiotoxicity and precipitate clonic‑tonic convulsions.,-22.75,0.6,Disease
"Elevational administration of cisplatin in patients with cholestatic injury can exacerbate valvular heart disease and precipitate clonic‑tonic convulsions, thereby aggravating underlying mood disorder symptoms.",-32.5,0.6,Disease
"Ritonavir, a protease inhibitor used in HIV therapy, has been shown to precipitate acute renal artery stenosis in patients with pre‑existing myopathic changes, thereby exacerbating cognitive impairment and increasing the risk of transient ischemic attacks.",-28.875,0.6,Disease
"Rivaroxaban, a direct factor Xa inhibitor, has been shown to reduce the risk of ischemic stroke in patients with atrial fibrillation but may precipitate hepatic complications in those with underlying cirrhosis.",-24.5,0.6,Disease
"Rifampicin treatment for pulmonary tuberculosis has been shown to inhibit CYP3A4, thereby increasing plasma concentrations of the antiretroviral drug lopinavir and exacerbating hepatic complications in patients with concurrent liver disease.",-28.875,0.6,Disease
"Cisplatin administration in patients with renal artery stenosis can exacerbate nephrotoxicity, thereby aggravating pre‑existing myopathic symptoms and increasing the risk of cognitive impairment.",-18.75,0.6,Disease
"Cimetidine, a histamine H2‑receptor antagonist, can exacerbate hepatic complication in patients with renal artery stenosis, thereby increasing the risk of myopathic symptoms and impairing cognitive function.",-26.75,0.6,Disease
"Cervical spondylosis often precipitates transient ischemic attacks in patients with concomitant renal artery stenosis, thereby exacerbating cognitive impairment.",-25.5,0.6,Disease
"A recent cohort study found that patients with renal artery stenosis receiving the renin‑converting enzyme inhibitor captopril exhibited a significant reduction in proteinuria, but a subset developed transient myopathic symptoms that resolved after dose adjustment.",-34.75,0.6,Disease
"A patient with a history of pulmonary tuberculosis developed a severe myopathic flare after receiving a high‑dose regimen of rifampicin, illustrating how the drug’s hepatotoxic potential can precipitate renal artery stenosis in susceptible individuals.",-30.0,0.6,Disease
"A higher dose of cisplatin is associated with nephrotoxicity in patients with renal artery stenosis, which can worsen their underlying myopathic symptoms.",-25.125,0.6,Disease
"In patients with renal artery stenosis, the use of angiotensin‑converting enzyme inhibitors has been shown to exacerbate renal impairment, thereby increasing the risk of acute kidney injury.",-19.25,0.6,Disease
"In a cohort of postmenopausal women with myopathic symptoms, the use of the chemotherapeutic agent cisplatin was associated with an increased incidence of renal artery stenosis, suggesting a potential causal link between drug exposure and vascular complications.",-27.5,0.6,Disease
"In renal artery stenosis patients, the use of the anti‑inflammatory drug celecoxib has been reported to reduce the risk of subsequent myocardial infarction by inhibiting cyclooxygenase‑2‑mediated platelet aggregation, thereby improving renal perfusion and decreasing hypertension‑induced renal injury.",-48.0,0.6,Disease
Patients with myopathic complications of pulmonary tuberculosis often experience renal artery stenosis that can aggravate their cognitive impairment.,-17.75,0.6,Disease
Patients undergoing cisplatin therapy for metastatic ovarian carcinoma often experience renal artery stenosis that exacerbates myopathic symptoms and leads to hepatic complications.,-26.875,0.6,Disease
"Patients who received cisplatin for metastatic ovarian carcinoma developed acute renal artery stenosis, a complication that further worsened their pre‑existing renal insufficiency.",-31.0,0.6,Disease
"An elevated dose of cisplatin exacerbated the patient’s pre‑existing renal artery stenosis, accelerating the progression of chronic kidney disease and precipitating a transient ischemic attack.",-27.625,0.6,Disease
"An aggressive myopathic form of pulmonary tuberculosis has been shown to aggravate renal artery stenosis, leading to severe hypertension and impairment of cognitive function in post‑menopausal patients.",-30.625,0.6,Disease
"An atypical presentation of renal artery stenosis was observed in a patient whose myopathic symptoms worsened after initiation of a CYP3A4 inhibitor, suggesting that the drug’s inhibition of simvastatin clearance exacerbated the underlying renal vascular disease.",-42.75,0.6,Disease
Use of the chemotherapeutic agent cisplatin in patients with renal artery stenosis can aggravate myopathic symptoms and precipitate acute hepatic complication.,-17.75,0.6,Disease
"Use statin therapy to lower LDL cholesterol, but in patients with pre‑existing renal artery stenosis the drug can precipitate acute kidney injury by further reducing renal perfusion.",-34.0,0.6,Disease
"Use‑dependent blockade of the Na⁺/K⁺‑ATPase by digoxin in patients with chronic heart failure exacerbates the risk of atrial fibrillation, thereby increasing the incidence of ischemic stroke and cerebral anoxia.",-40.75,0.6,Disease
"Treatment with the novel antipsychotic agent AGC significantly reduced the frequency of transient ischemic attacks in patients with a history of renal artery stenosis, while simultaneously ameliorating associated myopathic symptoms.",-35.25,0.6,Disease
Treatment of patients with pulmonary tuberculosis who develop renal artery stenosis after prolonged use of rifampicin can aggravate hepatic complications and worsen myopathic symptoms.,-25.25,0.6,Disease
"Treatment for a myopathic form of renal artery stenosis with the drug cisplatin can aggravate hepatic complications, worsening the patient's menopausal symptoms.",-38.0,0.6,Disease
"The oral administration of cisplatin in patients with myopathic renal artery stenosis often exacerbates hepatic complications, leading to impaired cognitive function.",-19.875,0.6,Disease
"The chemotherapeutic agent cisplatin exacerbates renal artery stenosis, leading to secondary myopathic symptoms and impaired cognitive function in patients with concurrent pulmonary tuberculosis.",-19.0,0.6,Disease
The administration of cisplatin in patients with myopathic renal artery stenosis can aggravate hepatic complications and precipitate acute tubular necrosis.,-17.875,0.6,Disease
"Pritazone, a novel anti‑inflammatory compound, reduced the incidence of acute myopathic episodes in patients with chronic TIA and mitigated renal artery stenosis‑induced hepatic complications.",-43.75,0.6,Disease
Preadolescent patients with a history of transient ischemic attack who subsequently develop renal artery stenosis experience an increased risk of myopathic complications due to impaired renal perfusion and secondary hormonal dysregulation.,-32.0,0.6,Disease
P‑statin administration alleviated the myopathic symptoms in patients with renal artery stenosis while simultaneously reducing the incidence of hepatic complications associated with the drug.,-28.75,0.6,Disease
"High‑dose aspirin therapy in patients with a history of pulmonary tuberculosis can exacerbate hepatic complications, potentially leading to acute liver injury.",-21.375,0.6,Disease
"High‐dose cisplatin therapy for pulmonary tuberculosis can exacerbate renal artery stenosis, leading to impaired cognitive function and myopathic symptoms in menopausal patients.",-21.625,0.6,Disease
"High serum cisplatin levels were associated with renal artery stenosis in patients with myopathic complications, suggesting that cisplatin-induced nephrotoxicity may exacerbate pre‑existing renal vascular disease.",-33.25,0.6,Disease
"Anticancer drug cisplatin is known to cause nephrotoxicity in patients with renal artery stenosis, thereby exacerbating the risk of acute kidney injury.",-23.375,0.6,Disease
"Antithrombotic therapy with low‑dose aspirin reduces the risk of transient ischemic attack recurrence in patients with renal artery stenosis, yet it may exacerbate underlying hepatic complications in those with pre‑existing cirrhosis.",-28.125,0.6,Disease
"Antihypertensive therapy with losartan alleviated the renal artery stenosis‑induced hypertension, but the patient’s subsequent myopathic side effects complicated the management of her chronic pulmonary tuberculosis.",-33.25,0.6,Disease
"High‑dose cisplatin induces nephrotoxicity that can exacerbate venous congestion in patients with pre‑existing bladder cancer, thereby worsening their overall renal function.",-20.625,0.6,Disease
"High-dose cisplatin therapy for bladder cancer frequently induces OAB symptoms, exacerbating venous congestion in HIV‑infected patients.",-22.75,0.6,Disease
"High‐dose cisplatin therapy for bladder cancer can induce severe nephrotoxicity that exacerbates venous congestion in HIV‑infected patients, thereby worsening myocardial impairment and precipitating urticaria and psychiatric symptoms.",-29.625,0.6,Disease
"Cisplatin administration in HIV‑infected patients with bladder cancer can aggravate venous congestion, potentially leading to OAB symptoms and myocardial impairment.",-19.125,0.6,Disease
"Cytotoxic chemotherapy with cisplatin exacerbated venous congestion in the bladder of HIV‑infected patients, worsening their OAB symptoms.",-23.5,0.6,Disease
"Carmofur, an antineoplastic agent, has been reported to induce acute urticaria in patients with bladder cancer, thereby necessitating the use of antihistamines to mitigate the allergic reaction.",-37.25,0.6,Disease
"The use of cisplatin in HIV‑infected patients with bladder cancer may exacerbate venous congestion, leading to acute urticaria and worsening myocardial impairment.",-15.875,0.6,Disease
"The clinical trial demonstrated that cisplatin treatment induces severe nephrotoxicity in patients with bladder cancer, thereby exacerbating their pre‑existing venous congestion and leading to worsening of lower‑extremity edema.",-33.5,0.6,Disease
"The antitumor drug cisplatin induces severe nephrotoxicity in patients with bladder cancer, exacerbating pre‑existing venous congestion and leading to acute renal failure.",-16.375,0.6,Disease
"A chemotherapy regimen that includes cisplatin has been shown to improve survival in patients with bladder cancer, but the drug’s nephrotoxic effect can precipitate acute kidney injury, especially in HIV‑infected individuals with pre‑existing renal impairment.",-29.375,0.6,Disease
"A combination of cisplatin and paclitaxel proved effective in treating bladder cancer yet induced severe nephrotoxicity, prompting the addition of amifostine to mitigate renal damage.",-25.5,0.6,Disease
"A chemotherapeutic agent such as cisplatin can induce nephrotoxicity and concomitant venous congestion, thereby exacerbating bladder cancer progression in HIV‑infected patients.",-21.125,0.6,Disease
"Rasburicase, a recombinant urate oxidase, has been shown to reduce the risk of tumor‑lysis‑associated hyperuricemia in patients with high‑grade bladder cancer undergoing cisplatin‑based chemotherapy, thereby preventing acute kidney injury.",-31.625,0.6,Disease
"Rifampicin treatment of HIV‑infected patients with bladder cancer has been associated with a paradoxical increase in urinary tract inflammation, potentially exacerbating overactive bladder symptoms.",-25.75,0.6,Disease
Ritonavir administration in HIV‑infected patients with bladder cancer can exacerbate venous congestion and precipitate new-onset urticaria.,-22.125,0.6,Disease
Patients with HIV‑infected individuals who develop bladder cancer are more likely to experience severe urticaria after initiating the chemotherapeutic agent cisplatin.,-18.25,0.6,Disease
"Patients co‑treated with cisplatin for bladder cancer often develop nephrotoxicity, a dose‑dependent adverse effect that can be mitigated by concurrent administration of the antioxidant drug N‑acetylcysteine.",-27.25,0.6,Disease
"Patients whose HIV‑infected status was confirmed and who subsequently developed venous congestion of the lower extremities were found to have a markedly increased risk of bladder cancer, suggesting a possible link between chronic inflammation, immune dysregulation, and urothelial carcinogenesis.",-36.25,0.6,Disease
